title,source
Solid gold toilet stolen from Winston Churchill's birthplace,0
"San Lorenzo woman dies at 102, DirecTV charges early termination fee",0
Source: LSU running back Lanard Fournette leaves team,0
Man gored by bison at Utah state park brings date back there and she is gored too,0
Former officer sentenced to 10 years in prison for wrong-apartment murder,0
"A San Diego backyard shed is for rent for $1,050 a month",0
"""Universal Orlando actor fired after making 'OK' symbol in family's photo.""",0
"The White House actually sought a cost estimate for Trump's alligator-filled border moat, officials say",0
"The White House actually sought a cost estimate for Trump's alligator-filled border moat, officials say",0
"KFC Publishing ‘I Love You, Colonel Sanders! A Finger Lickin’ Good Dating Simulator’ a Game Where You Romance The Colonel",0
"The White House actually sought a cost estimate for Trump's alligator-filled border moat, officials say",0
"Dancer's zombie-inspired Halloween makeup mistaken for medical emergency at hospital, report says",0
Family upset after universal character made “OK” symbol on girl’s shoulder,0
Russian iPhone user sues Apple for turning him gay,0
Hundreds of nuns trained in Kung-Fu biking a cross Himalayas to protest human trafficking,0
"DirecTV charges early termination fee after 102-year-old woman dies, family says",0
"Canadian spy agency presented with transparency award, refuses to confirm details about event",0
Universal Orlando employee fired for flashing white power sign in family photo: report,0
Track reduces use of new ‘crotch cameras’ after backlash,0
"Bay Area woman dies at 102, DirecTV charges early termination fee",0
"The White House sought a cost estimate for Trump's alligator-filled border moat, officials say",0
Not an X-post but I guess it could be,0
Russian man suing apple claiming “iPhone Turned him gay”,0
DirecTV Charges Woman Early Termination Fee After She Dies at 102,0
Church of Sweden Claims Jesus Christ Appointed Greta Thunberg As His ‘Successor’,0
"Canadian spy agency presented with transparency award, refuses to confirm details about event",0
"Trump wants an alligator moat, and migrants to be shot in the legs",0
'We Would Just Like Our Bear Back': giant teddy bear stolen from car window,0
500-lbs woman kills world’s oldest tortoise by accidentally sitting on it,0
"The White House actually sought a cost estimate for Trump's alligator-filled border moat, officials say",0
"The White House actually sought a cost estimate for Trump's alligator-filled border moat, officials say",0
"The White House actually sought a cost estimate for Trump's alligator-filled border moat, officials say",0
'I kept going': Nine-year-old enters 5km race ... and accidentally wins 10km event,0
"Ming, the Tiger Found Living in a Harlem Apartment Nearly 16 Years Ago, Dies at Animal Sanctuary",0
Mouse Falls From White House Ceiling Onto TV Reporter,0
Evangelical leader says impeaching Trump would anger ‘600 million Americans’,0
Reporters scramble after mouse falls from White House ceiling,0
RIP Ming the Apartment Tiger,0
RIP Ming the Apartment Tiger,0
"The White House actually sought a cost estimate for Trump's alligator-filled border moat, officials say",0
Exclusive: The FBI is running Facebook ads targeting Russians in Washington,0
Nearly Naked Deputy Forcibly Baptized Drug Suspect in Exchange For Not Going to Jail,0
"Donald Trump claims he didn't want moat, snakes, and gators at the Mexican border",0
9-year-old accidentally wins 10K race after missing turn,0
"Samsun claims to have developed a holographic ""display"".",0
Huh?,0
Trump Denies Proposing Alligators and Snakes at Border Wall Moat,0
Funeral of alleged drug dealer ends in chaos after police try to stop AK-47 gun salute,0
"Woman attacks husband with Nerf gun, faces abuse charges",0
"The White House actually sought a cost estimate for Trump's alligator-filled border moat, officials say",0
"The White House actually sought a cost estimate for Trump's alligator-filled border moat, officials say",0
Trump Denies Proposing Alligators and Snakes at Border Wall Moat,0
NASA Hands Elon Musk a Reality Check,0
Portugal’s navy reveals “tech guerrilla” unit creating tech toys that kill,0
Family outraged after a Universal character made 'OK' symbol on 6-year-old's shoulder,0
"The White House actually sought a cost estimate for Trump's alligator-filled border moat, officials say",0
"Two deer rescued after they get stuck in Italian clothing shop, swimming pool in Germany",0
Court Tells Man $172 Red Light Camera Ticket Is Actually Less Than $100 And Can't Be Challenged In Court,0
"Great Spotted Lanternfly War being waged to stop invasion of destructive, despised insect",0
Artificial intelligence and face scanning technology is being used in UK job interviews for the first time to identify best candidates,0
Shipwrecked Colombians clung to cocaine bales,0
"Boy, 9, accidentally wins 10K race after going wrong way in 5K race",0
"Trump Suggested Shooting Migrants and Creating Border Moat with Alligators and Snakes, Report Claims",0
A 9-year-old accidentally won a 10K race after missing a turn,0
Shipwrecked Colombians clung to cocaine bales,0
"For rent: San Diego backyard shed listed for $1,050 per month",0
Two Hamilton County deputies are named in a lawsuit claiming one of them baptized a woman. He did so while wearing only his boxers during a traffic stop.,0
"The White House actually sought a cost estimate for Trump's alligator-filled border moat, officials say",0
"Planned Parenthood to open ""mega-clinic"" in Illinois, a response to restrictive abortion laws in Missouri",0
Beer Vendor Fired After Charging Dolphins Fan $724 for Beer,0
Wtf is this,0
Trump suggested border moat with alligators and snakes,0
"A woman climbed into the lion's exhibit at the Bronx Zoo and started dancing, videos show",0
R Kelly lawyers argue for bail 'because he can't see two girlfriends in jail',0
Bronx Zoo: A woman climbed into the lion's exhibit at the Bronx Zoo and started dancing,0
Russian iPhone User Sues Apple for Turning Him Gay,0
"Bay Area woman dies at 102, DirecTV charges early termination fee",0
Trump tweeted ‘billions of dollars’ would be saved on military contracts. Then the Pentagon fired the official doing that.,0
Universal Orlando Resort fires 'Despicable Me' actor after 'OK' symbol,0
'Campaigning can be hard': Green Party candidate Steve Dyck happy to have support of iconic Kitchener bush,0
‘Horrible’ Canada goose crashes through U.K. taxi cab window,0
"Man sits in high school class with a knife to ‘test security,’ deputies say",0
"Florida man, 51, sits in high school class with a knife to ‘test security,’ deputies say",0
Fowl play as goose smashes way into taxi,0
Reporters scramble after mouse falls from White House ceiling,0
Scientists Engineer Bacteria That Poops Magic Mushrooms,0
Walruses attacked and sank Northern Fleet boat at Franz Josef Land,0
Delaware school sorry for serving Roseanne anthem rendition,0
How the sexy peach emoji joined the resistance,0
The Peach Emoji is apart of the “Resistance” against Trump,0
"Mom claims Ukrainian daughter, 9, she adopted was really a 22-year-old with dwarfism",0
Untitled Goose Game Inspires Local Goose To Go On Rampage (Maybe),0
First case of Brexit psychosis reported to doctors,0
Body fat that leaked from a corpse caused a fire at a crematorium,0
“a snake or alligator-infested moat”,0
The Bronx Zoo says a woman who climbed inside its lion exhibit could have been killed,0
"Man takes his date to a spot where he was gored by a bison, then she also gets gored by a buffalo.",0
"Planned Parenthood has been building a secret abortion ""mega-clinic"" in Illinois",0
Greta Thunberg Has Been Signed By A Death Metal Label,0
The Bronx Zoo says a woman who climbed inside its lion exhibit could have been killed,0
Trump wanted to reinforce his border wall with a water-filled trench full of snakes and alligators,0
"Woman dies at 102, DirecTV charges early termination fee",0
First case of ‘Brexit psychosis’ diagnosed in the UK,0
Trump suggested 'shooting migrants in legs' and a 'border moat with alligators and snakes',0
"Gang grabs Calcutta-bound truck with tea, but can’t drive",0
'No disposable cups': Boris Johnson's aide confiscates his drink,0
Angela Lansbury Thrilled to Be ‘Part of Reggae’ After Hearing ‘Murder She Wrote’ for the First Time,0
Woman Claims Deputy In Boxer Shorts Baptized Her In Soddy Lake After Searching Her Car For Drugs,0
Trump-Kim autographed pic can be yours for $24G,0
"Trump suggested shooting migrants in the legs, spoke of gator-filled border moat: report",0
"Trump suggested shooting migrants in the legs, spoke of gator-filled border moat: report",0
Legal Experts Warn Amber Guyger Verdict Could Set Dangerous Precedent Of Police Officers Not Being Allowed To Shoot Anyone They Want,0
Teen still searching for car he forgot where he parked a week ago,0
No coffee for you: Boris Johnson has disposable cup taken from him by aide,0
"Trump suggested shooting migrants and creating border moat with alligators and snakes, report claims",0
"Jeremy Clarkson's daughter hits out at presenter after he brands Greta Thunberg a ""spoilt brat""",0
Universal Orlando Resort fires 'Despicable Me' actor after 'OK' symbol,0
"Brexit referendum triggered man’s acute psychosis, doctor says",0
Man who took LSD at Disneyland sparks manhunt,0
Do you boast about your fitness? Watch out – you’ll unavoidably become rightwing,0
A California man who led police on a 2-hour chase through a corn maze was finally arrested,0
A California man who led police on a 2-hour chase through a corn maze was finally arrested,0
Tories ditch their ban on champagne at party conference as police help deliver crates of alcohol,0
Huge delivery of Champagne arrives at Tory conference as Boris Johnson's pals discuss poverty,0
4 of Mexico's cartels are fighting for control of the avocado business,0
India Isn’t Letting a Single Onion Leave the Country,0
West Japan prefecture to relax waste water controls as sea too clean for fish,0
Trump demanded border wall get an alligator or snake moat - and wanted immigrants shot in the LEGS,0
Watchdog bans Burger King tweet about 'milkshaking' Nigel Farage | Business,0
“A guy was hanging on top of a red car” Man clung onto moving car for 28 minutes after catching his Wife having an affair,0
Deepest ever dive finds 'plastic bag' at bottom of Mariana Trench,0
Take a look at the wedding dress made from crocheted toilet paper,0
"Trump suggested shooting migrants in the legs, spoke of gator-filled border moat: report",0
"Boy, 9, accidentally wins 10K race after going wrong way in 5K race",0
Colleges Create AI to Identify ‘Hate Speech’ – Turns Out Minorities Are the Worst Offenders,0
Poll: Only 4 in 10 Republicans think Trump mentioned Biden on Ukraine call even though he acknowledged doing so,0
"VIDEO: Tennessee mom charged for twirling baby, blowing smoke in her face on Facebook Live",0
Warnings on individual cigarettes to help smokers quit,0
"'Bird detained, given sandwich in jail cell by Dutch police after shoplifting arrest'",0
Thats one smart bird!,0
Thats a smart bird!,0
"Shoot Them in the Legs, Trump Suggested: Inside His Border War",0
Trump asked about building alligator-filled border moat,0
It's not just the razors that are locked up anymore,0
"Trump suggested snake-filled moat for border wall, shooting migrants in the legs to slow them down",0
Universal Orlando Resort fires 'Despicable Me' actor after 'OK' symbol,0
Trump demanded border wall get an alligator or snake moat - and wanted immigrants shot in the LEGS,0
"NEW YORK TIMES: TRUMP SUGGESTED SHOOTING MIGRANTS IN THE LEGS, PUTTING SNAKES OR ALLIGATORS IN WATER-FILLED TRENCH AT BORDER",0
"Trump asked about shooting migrants at border in legs if they threw rocks at agents, reportedly wanted a 'trench with deadly reptiles'",0
WATCH: Tory housing minister reveals “3D architects” are using “computers”,0
"Trump wants to put a moat filled with alligators and snakes with an electric, flesh-peircing fence.",0
Trump congratulates China on 70 years of communism.,0
Suspected gangbanger was ‘big fan’ of American Girl dolls,0
"Trump suggested shooting migrants in the legs, spoke of gator-filled border moat: report",0
"NYT: Trump suggested shooting migrants in the legs, filling trench with snakes and alligators to defend border",0
Trump congratulates China on 70 yrs of communism.,0
"“I have been told that I have a very engaging personality,” said the South African bikini model gifted 16 million dollars by Lebanon’s prime minister",0
Trump wanted the US/Mexico border to have a “snake-filled trench.”,0
"Trump asked about shooting migrants at border in legs if they threw rocks at agents, reportedly wanted a 'trench with deadly reptiles'",0
"President Donald Trump had at times privately talked about “fortifying a border wall with a water-filled trench, stocked with snakes or alligators""",0
Vendor arrested for charging man $724 for two beers at Dolphins game,0
"Man gored by bison at park. Later, he took a date there. She got gored.",0
'Sexy Vegan' Arrested on Charge of Sexually Assaulting His Pit Bull,0
Donald Trump ‘wanted a moat filled with SNAKES and electrified barbed wall’ along Mexico border to stop migrants,0
"Harvard Does Not Discriminate Against Asian-Americans in Admissions, Judge Rules",0
These Sheriffs Release Sick Inmates to Avoid Paying Their Hospital Bills,0
Trump reportedly suggested shooting migrants in the legs and filling a moat with snakes or alligators to fortify the border wall,0
Trump reportedly suggested shooting migrants in the legs and filling a moat with snakes or alligators to fortify the border wall,0
"Shoot Them in the Legs, Trump Suggested: Inside His Border War",0
Small Canadian Town Mayor suspended for misidentifying himself to gain free pool pass for the day,0
"Casey Anthony feels her 'biological clock is ticking,' is open to having more children, reports says",0
Prosecutor: Mom of baby killed by fentanyl in sippy cup wanted to 'relax and smoke marijuana',0
Michigan high school football team with no band invites band with no football to perform,0
Woman climbs into lion enclosure at the Bronx zoo and taunts the lions.,0
The Ukrainian orphan accused of being an adult was found living with another family in Indiana,0
The Ukrainian Orphan Who Is Actually Maybe an Adult Has Been Found in Indiana,0
"Trump suggested shooting migrants in the legs, spoke of gator-filled border moat: report",0
SaskPower 'scammer' RCMP warned of was actually SaskPower employee,0
New York Times: Trump suggested shooting migrants in the legs,0
NYC subway riders greeted by ad hyping ‘crazy’ Rudy Giuliani’s law offices: ‘Will work when drunk!’,0
Your Beef Stew Needs Ketchup,0
"Trump suggested snake-filled moat for border wall, shooting migrants in legs to slow them down.",0
"Shoot Them in the Legs, Trump Suggested",0
"Chick-Fil-A Opens First Restaurant in Megachurch Foyer, Still Closed Sundays",0
Family outraged after a Universal character made 'OK' symbol on 6-year-old's shoulder,0
EXCLUSIVE: Ukrainian dwarf adopted by American couple who claim she was 'an adult sociopath masquerading as a child' is now living in Indiana with a new devout Christian family of five who believe she was abandoned by them,0
Tweaker Fashion: Woman Sporting Meth Hair Bow Arrested,0
Bungie Will Release At Least One Non-Destiny Game by 2025,0
Cedar Park Council civility discussion breaks down from incivility,0
Cedar Park Council civility discussion breaks down from incivility,0
"Shoot Them in the Legs, Trump Suggested: Inside His Border War",0
Vegan Says That She's 'Poisoned for Life' After Accidentally Being Served Sausage Roll,0
Steve Mariucci Tells A Story of Watching Andy Reid Devour A 40-Ounce Steak In 19 Minutes,0
Jeremy Clarkson's daughter snaps back at father. Beautiful.,0
"Man gored by bison. Returns to the scene with girlfriend, who is then gored by bison.",0
A man who was gored by a bison in June took a date back to the same place - only for her also to be attacked.,0
Zuckerberg is frustrated because people don't realize how much he cares,0
Trump Requested a Snake and Alligator Fulled Moat and Spikes that Can Pierce Human Flesh for and Electrified Border Wall,0
Woman gored by bison in same Utah park as her date had been,0
Dallas man accused of fatally shooting burglar and going back to bed before calling 911,0
A man who was gored by a bison in June took a date back to the same place - only for her also to be attacked.,0
"Minnesota boy, 9, takes wrong turn on 5K race, ends up winner of 10K instead",0
Giuliani hires attorney to represent him in Ukraine investigation,0
"""Hillary Clinton says staying in her marriage was one of the 'gutsiest' things she's ever done""",0
"Aliens may have bugged space rocks to spy on Earth, scientist says",0
Legal Experts Warn Amber Guyger Verdict Could Set Dangerous Precedent Of Police Officers Not Being Allowed To Shoot Anyone They Want,0
India Isn’t Letting a Single Onion Leave the Country,0
"Former Yahoo engineer pleads guilty to searching 6,000 user accounts for nudes",0
The Bronx Zoo says a woman seen dancing inside its lion enclosure is lucky to be alive,0
"""Hillary Clinton says staying in her marriage was 'gutsiest' thing she's ever done""",0
India Isn’t Letting a Single Onion Leave the Country,0
"Boy running 5K takes wrong turn, accidentally wins 10K instead",0
Forever 21 Founders Borrowed $10 Million From Their Daughters,0
Mike Pence tells Americans to ‘Spend more time on your knees than on the Internet’,0
"The state of Chicago hired a Florida man who caught an alligator for them in less than 24 hours, eight days after it was first spotted",0
MIKE PENCE TELLS AMERICANS TO 'SPEND MORE TIME ON YOUR KNEES THAN ON THE INTERNET',0
Comcast joins anti-trust fight against Google,0
‘Stacey Dash listed as a white woman upon arrest’,0
"Lawsuit claims Hamilton County Deputy strips to underwear, baptized drug suspect",0
A pug has been hired by 343 industries to make alien sounds for Halo Infinite,0
Comcast joins anti-trust fight against Google,0
How the sexy peach emoji joined the resistance,0
"Kanye West quits secular music, says he'll make only gospel music",0
Tom Cruise meets Ukraine's president caught in U.S. impeachment scandal,0
"Boy, 9, accidentally wins 10K race after going wrong way in 5K race",0
Sci-fi makes you stupid' study refuted by scientists behind original research,0
"Email signature ruling 'cost seller £25,000'",0
"NYPD officer killed in the Bronx died by friendly fire, police say",0
Man arrested for singing 'Kung Fu Fighting',0
Man named Sexy Vegan charged in sexual assault of his dog after video surfaces online,0
R. Kelly's lawyer is complaining that the singer can visit with only one of his girlfriends at a time,0
Man arrested for singing 'Kung Fu Fighting',0
Rolling down the aisle: Why this local’s toilet paper wedding dress is the country’s best,0
Anti-racism event hosted by Edinburgh University bans white people from asking questions,0
A Sports Store Apologizes for Showing Porn on Their Screens for Hours - Newz Wave,0
"He took a date to the park where he was gored by a bison, figuring it wouldn't happen again. He was wrong.",0
Only 4 in 10 Republicans think Trump mentioned Biden on Ukraine call even though he acknowledged doing so,0
Sask. man barred from U.S. for 5 years after trying to volunteer at music festival,0
"Woman Climbs Into Bronx Zoo Exhibit, Appears to Taunt Lion",0
"In court fight, Union College asks for authority to expel student",0
how the sexy peach emoji joined the resistance,0
Plane passenger opens emergency exit for 'a breath of fresh air',0
North Liberty brothers get in fist fight over Carson King,0
Chinese Air Passenger opens Emergency Exit for breath of fresh air,0
Study reveals chemical in McDonald's fries may be cure for baldness,0
"Union College student alleges disability discrimination, retaliation",0
University apologizes for touting diverse student body with video of all-white students,0
Moms wanting to make video game radios more realistic,0
Only 4 in 10 Republicans think Trump mentioned Biden on Ukraine call even though he acknowledged doing so,0
Theft of disputed chalupa is order of the day at Indiana Court of Appeals,0
Tractor protest sparks 'worst Dutch rush hour',0
Tom Brady's unusual method of keeping his centers' butts dry revealed,0
Doctors shocked to discover potato growing inside Colombian woman's vagina: I inserted it to prevent pregnancy,0
Angry Dutch farmers clog up 700 miles of highway during protest over emission rules,0
First 'mobile phone lane' for slow moving pedestrians,0
Manchester opens UK’s first slow lane for people looking at phones while walking,0
A Day Without Whopper: The Day Burger King Asked Its Customers To Go To McDonald's,0
"Former Yahoo engineer hacked 6,000 accounts seeking pornographic images and videos",0
"Italian Youth Soccer Coach Fired For Calling Greta Thunberg A ""Whore"" On Facebook",0
"Man arrested for singing ""Kung Fu Fighting""",0
Goose Related Crime Up 2000 Percent After Untitled Goose Game Release,0
Babies in the womb have lizard-like hand muscles,0
"Texas woman tied up, robbed $6 million in valuables by armed home invaders",0
‘Germs are not a real thing’: Fox News host says he hasn’t washed hands in 10 years,0
South Carolina city kills residential solar because math is hard. The city of Georgetown has instituted a $50 monthly “accounting charge” on all residential solar customers because the city’s accounting software can’t comprehend the concept of energy being sent to the grid.,0
R. Kelly's lawyer is complaining that the singer can visit with only one of his girlfriends at a time,0
BMW recalls Toyota Supra because that's the world we live in now,0
Reporters scramble after mouse falls from White House ceiling,0
Church of Sweden proclaimed Greta Thunberg 'successor' to Jesus Christ,0
Goose-Related Crime Up 2000% Percent After Untitled Goose Game Release,0
Huge delivery of Champagne arrives at Tory conference as Boris Johnson's pals discuss poverty,0
Fowl play: Police called after goose smashes through taxi window in Nottinghamshire,0
Teachers are turning to 'sugar daddy' dating site to supplement their salary,0
St. Margaret's Bay Residents Want to Put Blue Bags in Blue Bins,0
"Cat Allergies: Causes, Symptoms, Treatments and Reducing Exposure",0
Metallica's Lars Ulrich Kissed by His Wife Jessica in Public,0
Robert Jeffress: Democrats Worship The Demon God Moloch,0
Anti-totalitarianism day: No permits for Singapore assemblies,0
Humboldt Park Leaders Holding New Peace Walk After First One Was Canceled Due To Shooting Along Route,0
Drone finds fugitive living in cave after 17 years on run,0
Vendor arrested after charging $724 for two beers at Miami Dolphins game,0
Ukraine's Zelensky talks movies with Tom Cruise amid political storm,0
I can't with this planet,0
School bus driver arrested on alleged DUI after child calls 911 to report her 'drunk',0
"This ex-con started her popcorn business while in prison. Now, it's blowing up",0
Detroit house owned by state rep demolished without her knowing,0
VIDEO: ‘Robocats’ are helping the elderly fight loneliness,0
Antonio Brown’s Tweet About His English Paper Obviously Contains Typos,0
"""Poor decision made"" when field set on fire in effort to dry it",0
Zombies wanted: North Carolina town is staging ‘apocalypse’ survival test,0
New app claims it can identify venture capitalists using facial recognition,0
Prostitute calls cops after irate man demands refund,0
"He took a date to a park where he was gored by a bison, figuring it wouldn’t happen again. He was wrong.",0
Venture capitalists to warn startups of the downside of IPOs in San Francisco meeting,0
"Commuters get an eyeful after pair breaks in, uploads porn to Michigan billboard",0
Ready student one? Universities launch degrees in esports,0
Motorists get eyeful as porn plays on electronic billboard,0
More than a dozen Indiana high school students hospitalized after mistakenly injected with insulin,0
American Airlines flight diverted to Denver after unruly passenger reportedly smokes weed on board,0
"Walmart associates want $15 per hour. Instead, they're getting new vests",0
Woman suffered ‘broken heart’ after mistaking wasabi for avocado,0
"Walmart associates want $15 per hour. Instead, they're getting new vests",0
Police: Man killed a 6-year-old boy trying to 'cast the demon out',0
"Man who survived bison goring goes on a date, his date gets attacked by bison.",0
"Boy, 9, accidentally wins 10K race after going wrong way in 5K race",0
Woman claims adopted girl she 'abandoned' was really an adult dwarf who wanted to kill her family,0
R. Kelly's lawyer is complaining that the singer can visit with only one of his girlfriends at a time,0
"A couple who adopted a '6yr-old Ukrainian girl' have been charged with abandonment, but claims the girl had dwarfism and was actually a 22yr-old sociopath masquerading as a child and tried to kill the couple several times.",0
Teacher who allowed pupils to watch of Shrek raping boy is struck off,0
"I’m Not Saying Minimalism Is Homophobic, But",0
R. Kelly's lawyer is complaining that the singer can only visit with one of his girlfriends at a time,0
R. Kelly's lawyer is complaining that the singer can only visit with one of his girlfriends at a time,0
'I kept going': Nine-year-old enters 5km race ... and accidentally wins 10km event,0
‘Sexy Vegan’ Arrested on Charge of Sexually Assaulting His Pit Bull,0
Man who changed his name to Sexy Vegan arrested for sexually assaulting his pitbull,0
‘Germs are not a real thing’: Fox News host says he hasn’t washed hands in 10 years,0
R Kelly's lawyer complains that only one girlfriend can visit him at a time,0
