title,source
Bold New Strategy: Febreze Has Released A New Line Of Guns To Shoot Your Dog With If It Starts To Smell,1
Casting Bawl,1
Man Going To Restroom Deputizes Friend To Order Him Another Beer,1
"Whoa, Slow Down There, Buddy. Nobody Dates My Daughter Without Telling Me Which ‘Sailor Moon’ Character They Are First",1
Apple Fans Disappointed After Company Unveils Same Overpriced CEO That Barely Fucking Works,1
The Dalai Lama Said WHAT?!,1
More Than 1 Million Ordered To Evacuate Due To Hurricane Florence,1
Apple Announces New Trade-In Offer For Customers To Exchange Their Old iPhones For Absolutely Nothing,1
Where IS He??????,1
"BLAMMO! When The BAD MAN Came Into The House, The Gun Was Use And It KILL: His Body",1
"Whoa, Slow Down There, Buddy. Nobody Dates My Daughter Without Telling Me Which ‘Sailor Moon’ Character They Are First",1
Good Samaritan: Man Shouts Sex Talk To Boy Stuck At Bottom Of Well,1
Novelist who wrote about ‘How to Murder Your Husband’ charged with murdering her husband,1
Man Going To Restroom Deputizes Friend To Order Him Another Beer,1
Pope Starting To Suspect Bishops Getting Huge Erections During Meeting On Child Sexual Abuse Might Be Pedophiles,1
7 Venmo Transactions Between Luke And Owen Wilson That Make It Seem Like They’ve Been Practicing Dentistry On Each Other,1
Look Who Came Crawling Back: The Filthy Public Toilet Stall You Thought You Were Too Good For Turned Out To Be Your Best Option,1
Dermatologist Recommends Not Caring So Much What Other People Think,1
Sweatshop Worker Doesn’t Even Want To Know Working Conditions Of Place Her Company Gets Fabric,1
"Cameraman Strikes Gold With Tubby Fan Eating Ice Cream, Dancing, Holding Baby",1
Couple Nervous To Admit They Met Online In Comments Section Of ‘How To Iron Shirt’ Video,1
Study: Nuclear Power Necessary To Cut Climate Emissions,1
Middle School Janitor Can Already Tell He's Going To Have To Befriend New Kid,1
FEMA Frantically Prepares Apology For Screwing Up Hurricane Florence Response,1
Ed Sheeran Said WHAT?!,1
Millions Of Retirees Absolutely Sopping Wet After Seeing Alex Trebek’s New Beard,1
"Mike Pence Condemns Atheists, Homosexuals, And Feminists For Role In Forcing God To Punish America On 9/11",1
Russell Wilson Asks Seahawks To Modify Play Where He’s Immediately Tackled By Six Players,1
"What The Mainstream Media Won’t Tell You: 17 Years Ago, Radical Islamic Terrorists Crashed Airplanes Into The World Trade Center, Killing Thousands Of Hardworking Americans",1
New Subway Promotion to Honor September 11,1
Bad Game Design: This Incredibly Lifelike Simulation Of New York City Is Ruined By The Unrealistic Presence Of A Spider-Themed Crimefighter,1
"Mike Pence Condemns Atheists, Homosexuals, And Feminists For Role In Forcing God To Punish America On 9/11",1
Matthew Berry Admits He Just Drafts Fantasy Players Whose Names He Recognizes,1
Survey Finds Majority Of Autonomous Car Crashes In California Caused By Human Error,1
Trump Unfairly Claims Credit For Rise In Economic Inequality That Occurred Under Obama’s Watch,1
Biggest Revelations From Bob Woodward’s New Trump Administration Book,1
Middle School Janitor Can Already Tell He Going To Have To Befriend New Kid,1
Nation Longing For Simpler Time Of Knowing Exactly Who They Wanted To Kill And Why,1
Comments Mysteriously Disabled On YouTube Video Of Sparrow In Yard,1
"Your Horoscopes — Week Of September 11, 2018",1
"Trump Boys Leave $5 Bill, Candy Bar Under Propped-Up Laundry Basket In Effort To Catch Op-Ed Writer",1
4 Times Shaquille O’Neal Tried To Use The Fact That He Is Tall To Get Out Of Paying At Bed Bath & Beyond,1
Car Of The Future: Elon Musk Has Revealed That The Next Tesla Will Feature A Ziploc Bag Of Cashews In The Glove Compartment,1
Back For Seconds: Barack Obama Has Once Again Invited Ahmed To His House To Get Another Look At That Sweet Goddamn Clock He Built,1
"Report: That’s Expensive, Please Put That Down",1
U.S. Jobless Claims Fall To 49-Year Low,1
Defiant Dallas Police Officer Claims Anyone Could Have Mistaken Black Man’s Apartment For Gun,1
Americans Observing 911 By Trying Not To Masturbate,1
Cynthia Nixon raises eyebrows with bagel order,1
CBS To Retain Les Moonves’ Services In Smaller Sexual-Predator-At-Large Role,1
Myrtle Beach Resident Refuses To Evacuate From Family’s Ancestral Ron Jon Surf Shop,1
Study: 83% Of Marathon Spectators Only Attend For Sick Thrill Of Watching Fellow Man Suffer,1
Study Finds 44% Of Young People Deleted Facebook App From Phone In Last Year,1
Neil deGrasse Tyson Said WHAT?!,1
Defiant Dallas Police Officer Claims Anyone Could Have Mistaken Black Man’s Apartment For Gun,1
https://www.theonion.com/defiant-dallas-police-officer-claims-anyone-could-have-1828942372,1
Such An Incredible Achievement!,1
Post This Video On Your Facebook Wall To Let Everyone Know Your Son Has Been Ruled Out As A Suspect In Your Husband’s Murder!,1
Obama Urges Young Voters To Ignore How Many Lousy Candidates Democratic Party Runs,1
Class Is Dismissed,1
Absolutely Devastating: The Members Of U2 Have Announced That Bono Is Going To Get Bonked On The Head By A Coconut And Die In Exactly 3 Years,1
Man Wouldn’t Be Eating At Red Robin If He Knew Bus Was Going To Hit Him In 18 Minutes,1
"The Week In Pictures – Week Of September 10, 2018",1
Modern-Day Oscar Wilde A Homosexual,1
"Whoa, Classmate Got Totally Hideous Over Summer Vacation",1
India Decriminalizes Homosexuality,1
God Furious At Every Human Who Isn’t Actively Trying To Get As Fat As Possible Off Bounty He Provided,1
The Grouchiest Album Imaginable: An Oral History Of The Red Hot Chili Peppers’ ‘Californication’,1
Blissful Ignorance Commemorated On Annual 9/10 Anniversary,1
New Psychedelic Weight Loss Drug Transforms Food Into Monstrous Hallucinations,1
Delicate Little Man Kept Awake All Night By Having Coffee After Four O’Clock,1
Fucking Idiot Has Perfect GIF For That,1
MTA Official Too Nervous To Tell Commuters Waiting For Train That Service Shut Down Permanently An Hour Ago,1
Fan Going To See How First Few Games Go Before Declaring Moral Objection To Watching NFL,1
World’s first Vegan slaughterhouse! [Baby-stepped approved],1
Biden To Decide On 2020 Run By January,1
How bad do you wish you were King Arthur?,1
Vaping By The Numbers,1
"Cory Booker Expelled From Senate, Stripped Naked, Forced To Wander Maryland Bog In Woe For All Eternity",1
‘New York Times’ Publishes Bombshell Anonymous Opinion Article From White House Insider,1
Eiffel Tower Finally Completed,1
5 Awesome ’90s Toys That You Can Rub On Your Legs In The Dark,1
New Study Confirms This Didn’t Even Feel Like A 4-Day Work Week,1
MTA Official Too Nervous To Tell Commuters Waiting For Train That Service Shut Down Permanently An Hour Ago,1
"Deformed, Half-Feathered Audubon Society President Flees Into Forest After Injecting Self With Bird DNA",1
Did ‘Sesame Street’ Go Too Far When It Showed Bert And Ernie Dragging Their Human Puppeteer Dead Behind The Back Of Their Car To Teach Children About Mutiny?,1
This guy on an ONION video about ripping people’s heads off instead of lethal injection.,1
"‘Rock The Caliphate’ Charity Concert Features U2, Ed Sheeran, Dua Lipa Coming Together To Raise Money For Struggling Islamic State",1
Man Discovers Huge Cache Of Rare Fossils While Walking Through Natural History Museum,1
Is Football Bad For The NFL?,1
"Returning Jesus Christ Downed By U.S. Missile Defense 30,000 Feet Before Making Landfall",1
2018 NFL Season Storylines To Watch,1
"I Love My Children, But Not Enough To Make Them Corn On The Cob",1
Bear Grylls Said WHAT?!,1
"Apple Releases Brief, Fleeting Moment Of Excitement",1
Compilation of Burt Reynolds’ best T.V. Moments.,1
Facebook Employee Group Aims To Promote Political Diversity,1
Fucking Idiot Has Perfect GIF For That,1
How Many Of These Needlessly Hostile Ways Have You RSVP’d To Someone’s Baby Shower?,1
‘The Onion’ Has Chosen To Publish An Anonymous Op-Ed From Two Sources Close To Trump Who Think Their Dad Is The Best President Ever,1
Woman Would Have Had Awesome Time Aborting Fetus If It Weren’t For Angry Protestors Screaming Outside Clinic,1
Kavanaugh Surprised Senate Not Questioning Fact He Never Went To Law School,1
"Is It Fair To Not Pay College Football Players When The Mascots Make $10,000,000 A Year?",1
Complete Disaster: Yao Ming Has Ruined A Jewish Wedding By Accidentally Hoisting The Married Couple Through A Ceiling During The Hora,1
"Is It Fair To Not Pay College Football Players When The Mascots Make $10,000,000 A Year?",1
"Is It Fair To Not Pay College Football Players When The Mascots Make $10,000,000 A Year?",1
Fabled Lost City Of Gold Finally Discovered Off I-95 Outside Baltimore,1
Legends Of Sports: The Incredible Story Of When John McEnroe & Babe Ruth Beat Jesse Owens & Kristi Yamaguchi In A Three-Legged Race,1
Plop Your Infant In Front Of These Pictures Of Gore Vidal While You Go Spend A Week In Las Vegas! [Sponsored By The Las Vegas Tourism Board],1
Does Brett Kavanaugh’s 1996 Legal Essay ‘Donald Trump Should Be Allowed To Commit Crimes If He Becomes President’ Disqualify Him From The Supreme Court?,1
Fabled Lost City Of Gold Finally Discovered Off I-95 Outside Baltimore,1
Purina Introduces ‘Own Shit’ Dog Food Flavor,1
Aging Tom Brady Decides To Conserve Energy By No Longer Returning Kicks,1
Clothes Come To Forefront As Major Theme In This Year’s New York Fashion Week,1
Competitive Adidas Unveils Darren Wilson As New Face Of Brand,1
Giada De Laurentiis Said WHAT?!,1
Report: Dog’s Nose Must Really Itch If He Willing To Repeatedly Kick Self In Face That Hard,1
2018 NFL Season By The Numbers,1
Disillusioned Woman Now Wondering If Any Of Her Magical Vagina Stones Have Healing Powers,1
Carl Bernstein Weeps Uncontrollably After Learning Bob Woodward Wrote A President Book Without Him,1
Nike Makes Colin Kaepernick Face Of New Ad Campaign,1
Shohei Ohtani Regrets Not Researching Which Teams Were Good Before Signing With Angels,1
Kavanaugh Panicking After Botching Part Of Confirmation Where He Asked If He Rejects Satan,1
Amazon Reaches 1 Trillion Labor Violations,1
John Kelly Relieved Trump So Fucking Stupid He’ll Believe Woodward Made Up Disparaging Quotes,1
Kavanaugh Packing Gun At Congressional Hearing In Case Parkland Father Tries To Shake His Hand Again,1
"World’s Cartographers Continue Living Secret Life Of Luxury On Idyllic, Never Disclosed 8th Continent",1
A Few Half Ideas For Getting My Son Off The Roof,1
The Onion’s Guide To Twitch,1
Two-Faced House Guest Who Didn’t Need Anything Suddenly Wants Glass Of Water,1
"Sasha And Malia Refuse To Smoke Cigarettes With Me, So I Will Never Speak To Them Again (By Barack Obama)",1
Chivalry Isn’t Dead: Man Warms Up Shivering Girlfriend With His Toupee,1
The Backlash Continues: Colin Kaepernick Is Joining The Nike Boycott After Learning It Doesn’t Make Top Hats,1
HBO Ending Its Skinemax Offerings,1
PR Disaster: Nike Is Under Fire After It Released An Ad Featuring A Photo Of Colin Kaepernick That Was Way Too Close Up,1
Trump Disapproval Rating At All-Time High,1
15-Year-Old Girl Viciously Torn Apart By Rabid Pack Of Peers,1
PR Disaster: Nike Is Under Fire After It Released An Ad Featuring A Photo Of Colin Kaepernick That Was Way Too Close Up,1
Literary Theorists Admit They Still Have No Idea What Animal Farm About,1
Embarrassed Brett Kavanaugh Can’t Believe He Wore Handmaid Costume On Same Day As Protesters,1
David Remnick Quietly Relieved He Won’t Have To Lose Debate To Steve Bannon In Front Of Everyone,1
"Seizing The Moment: Amid Backlash Over Nike’s New Colin Kaepernick Ad, Skechers Just Released A Commercial Boasting That They’re Spineless Cowards Who Stand For Nothing",1
Morrissey Said WHAT?!,1
Embarrassed Brett Kavanaugh Can’t Believe He Wore Handmaid Costume On Same Day As Protesters,1
Competitive Adidas Unveils Darren Wilson As New Face Of Brand,1
I Can No Longer In Good Conscience Eat Meat After Seeing That Tic-Tac-Toe-Playing Chicken At The County Fair,1
Societal Collapse Narrowly Averted After Man Honks Horn At Car Paused At Green Light,1
California Man Charged With Threatening To Kill ‘Boston Globe’ Employees,1
"Historic Sale: The Vincent Van Gogh Painting Of Tony Soprano, Vito Corleone, Scarface, And Henry Hill From 'Goodfellas' Playing Pool Just Sold For A Record $600 Million At Sotheby’s",1
The Mystery Lives On: Researchers At Oxford Have Concluded That They’ll Never Know How Outback Steakhouse Bread Can Be So Dark Brown But Taste Regular,1
"The Peel: ""Jump Rope With A Rat Tail"" By Daniel Twine",1
Alexander Ovechkin Thrilled To Learn He Won Stanley Cup Last Year,1
No Big News For Bagels: The Bagel Industry Just Issued Its Daily 600-Page Report On The State Of The Bagel Industry And Nothing Major Has Changed Since Yesterday,1
Ask A College Professor Having Trouble With The Audiovisual Equipment,1
"Your Horoscopes — Week Of September 4, 2018",1
Trail Of Ants Better Be Leading Toward Something Delicious,1
Scientists Determine Tingling Sensation Of ASMR Caused By Mass Brain Cell Die-Off,1
Nation Baffled By Childless Woman Who Doesn’t Even Have High-Powered Career,1
Alabama Begins Offering Tax Credit To Attract More YouTube Fail Compilations To Be Filmed In State,1
"The Week In Pictures – Week Of September 3, 2018",1
Ariana Grande Apologizes For Skirt That Caused Bishop Ellis To Touch Her Breast,1
White House Counsel To Step Down In Fall,1
Refill with Kikkoman only!,1
NASCAR Race Stops To Wait For Family Of Ducks To Pass,1
Evolution Definitively Proven As Scientists Capture First-Ever Footage Of Chimpanzee Transforming Into Human,1
Trump Disapproval Rating Reaches All-Time None Of This Matters,1
Trump Teeters On White House Ledge Weighing Pros And Cons Of Killing Self Right Now To Distract From McCain’s Funeral,1
Eminem Horrified Upon Being Informed That ‘Faggot’ Actually A Harmful Gay Slur,1
Jeffrey Dahmer Estate Releases Collection Of Never-Before-Seen Victim Remains,1
Trump Disapproval Rating Reaches All-Time None Of This Matters,1
"Heartwarming: When This Subway Employee Had To Walk 20 Miles To Work Because He Couldn’t Afford A Car, The CEO Of Subway Drove Alongside Him To Cheer Him On",1
Restaurant Entrance Doesn’t Work All Damn Day To Be Called ‘Other Door’,1
Free Toothpick Transforms Schlubby Restaurant-Goer Into Aloof Bad Boy,1
Do The Buccaneers Regret Bringing In A Sexual Predator To Mentor Jameis Winston?,1
"Dad Just Wants Nice, Simple Xbox One For Checking Email",1
Relationship Experts Recommend Telling Woman You Would Die For Her At Outset Of First Date,1
Timeline Of The American Education System,1
Report: High School Marching Band Definitely In Shape Of Something,1
Do The Buccaneers Regret Bringing In A Sexual Predator To Mentor Jameis Winston?,1
Tom Hanks Said WHAT?!,1
Russian hooker who had sex with Donald Trump mocks his micropenis,1
4 Encounters Between An Alien Civilization And A U.S. President That Didn’t Matter And Were A Big Waste Of Time,1
How Many Of These Ways Has Your Mom Referred To Joe Camel When Struggling To Remember His Name?,1
Does Notre Dame’s Mascot Trivialize The Heartbreaking Genocide Of Leprechauns?,1
Warden Scrambling To Find Ways To Punish Striking Inmates Worse Than Their Typical Living Conditions,1
CDC Reports Surge In Sexually Transmitted Disease,1
"Did Bill Clinton Cheat On Monica Lewinsky With KILLARY? Yes, And Our GOVERNMENT Doesn’t Want You To Know",1
University Admits It Pretty Weird They Let Bunch Of 20-Year-Olds Live In Big Mansion And Torture Each Other,1
"Eagles Hang Beer-Drenched, Charred Super Bowl Banner",1
Ron DeSantis Clarifies That ‘Monkey’ Comment Was Intended As Subtle Enough Dog Whistle To Get Away With,1
News in Brief Ron DeSantis Clarifies That ‘Monkey’ Comment Was Intended As Subtle Enough Dog Whistle To Get Away With,1
Political Scientists Reassure Americans That Stripping Minorities Of Citizenship Usually Where Descent Into Fascism Peters Out,1
White House Counsel To Step Down In Fall,1
Alexandria Ocasio-Cortez Said WHAT?!,1
Which Grievances Do You Wish To Bring Before The King?,1
Praying Mantis Hesitantly Agrees To Try Girlfriend’s Sexual Fantasy Of Eating His Head During Intercourse,1
Ryan Zinke Calls For Legislation To Slow Down Destruction Of Wildlife So He Can Truly Savor Every Minute Of It,1
NRA Praised For Decreasing Stigma Of Mentally Ill Acquiring Firearms,1
Do The Buccaneers Regret Bringing In A Sexual Predator To Mentor Jameis Winston?,1
"Disloyal Piece Of Shit: This Middle Schooler Casually Switched From Playing The Clarinet To The Alto Saxophone, So He’ll Almost Certainly Cheat On His Wife Someday",1
Woman Who Has Been Let Down By So Many Leave-In Conditioners Can’t Bear To Put Herself Out There Again,1
Man Wishes There Was Some Sort Of Sign He Could Put On His House To Let Visitors Know He Has Gone Fishing,1
Great Villains In Cinema History,1
Report Finds Poor Often Hit Hardest By 18-Wheelers,1
U.S. Judge Bans 3D-Printed Gun Blueprints,1
Nick Foles Reveals He Turned Down Big Volunteer Opportunities At Church To Remain With Eagles,1
Friendless Loser? Play This Video At Maximum Volume To Make Your Neighbors Think You Have Lots Of Friends Over For A 'Point Break' Viewing Party!,1
"Heartwarming: When This McDonald’s Employee Had To Walk 20 Miles To Work Because He Couldn’t Afford A Car, The CEO Of McDonald’s Drove Alongside Him To Cheer Him On",1
White Supremacist Living Fulfilling Racist Life Since Getting Kicked Offline,1
"As airlines hike checked bag fees, charges for carry-on luggage could be next | CBC News",1
Their families are hoping someone actually remembers to put together a funeral service,1
Manafort Sought Plea Deal Before Talks Broke Down,1
Satan Refuses To Accept Any More Catholic Priests In Hell,1
It's Almost The Weekend!,1
Randy Jackson Said WHAT?!,1
6th-Graders Feel Kind Of Bad After Seeing How Easy It Was To Make Young Teacher Cry,1
Choking Man Can Already Tell Good Samaritan Has No Fucking Clue What They’re Doing,1
Elon Musk Unveils New Clean Energy Luxury Car Pulled By 8 Tesla Employees,1
What Did You Think Of My Homemade Mead? Be Honest.,1
"Incredible Promotion: If You Go To The Store And Buy 5 Cowboy Hats And Send ClickHole A Picture Of Yourself Wearing Your Favorite One, You Can Keep Them All, No Questions Asked",1
Trump Revokes Puerto Rico Recovery Funds After Learning Hurricane Maria Had Fewer Survivors,1
5-Year-Old Admits It Pretty Messed Up Up Spider-Man Visiting His Birthday Party When He Could Be Out Saving Lives,1
Vatican Officials Quietly Paint Over Part Of Sistine Chapel Where Michelangelo Depicted Adam Fingering Cherub,1
A Look At The Class Of 2022,1
So-Called Professional Gamer Not Even Racist,1
Hot Hot Hollywood: Drew Carey Has Been Standing In A Barnes & Noble For 3 Hours Feeling The Embossed Letters On The Cover Of ‘Ripley’s Believe It Or Not! 2015’ With His Eyes Closed,1
"This Beautiful Fan-Made Prince Tribute Couldn’t Get The Rights To ‘Purple Rain,’ So They Got A Local Opera Singer To Sing A Similar Song Called ‘Sex Guy Loves To Be Purple’",1
Poll: 70% Of Americans Support Medicare For All,1
"When This Boy With A Colostomy Bag Said He Was Sad There Were No Superheroes Like Him, Marvel Told Him It’s Absolutely Crucial For Superheroes To Have A Functioning Anus",1
"When This Boy With A Colostomy Bag Said He Was Sad There Were No Superheroes Like Him, Marvel Told Him It’s Absolutely Crucial For Superheroes To Have A Functioning Anus",1
This just in from the onion,1
Tips For Making The Most Of Your Next Doctor’s Visit,1
U.S. Troops In Iraq Excited To Finally Return To Afghanistan,1
Louis C.K. Fan Disappointed At Lack Of Psychosexual Power Games In New Material,1
"Pope Promises More Open, Transparent Molestation In Future",1
NRA Calls For Department Of Education To Provide Every Student With Body Bag,1
"No Amount Of Alcohol Good For You, Report Finds",1
Humiliation Of Women Receives 10 Billionth Standing Ovation,1
Dick Pulled Back Out Again,1
Trump: ‘I Remember Flying The Plane That Bombed The USS Arizona During Pearl Harbor’,1
Republicans Outraged Over RedTube Censoring Of Conservative Voices,1
New Ted Cruz Campaign Ad Features His Kids Begging For Beto O’Rourke To Be Their New Dad,1
New Ted Cruz Campaign Ad Features His Kids Begging For Beto O’Rourke To Be Their New Dad,1
Raid Recalls Entire Line Of Insecticide After Realizing Food Chain Would Collapse Without Bugs,1
"Your Horoscopes — Week Of August 28, 2018",1
Button-Up Shirt Goes On Life-Changing Odyssey Around Dry Cleaner’s Garment Conveyor,1
Flooding The Airwaves,1
Coin Collector Has Some Pretty Fucking Nice Coins,1
Idris Elba Says He Will Not Be The Next James Bond,1
Trump Locked Out Of White House After Accidentally Revoking Own Security Clearance,1
White House Flag Now Moving Minute To Minute To Indicate Trump’s Mood,1
White House Flag Now Moving Minute To Minute To Indicate Trump’s Mood,1
People Open Up About How They Started Believing In God After Finding A Big Bag Of Laundry In A Barn,1
Everything Is So Disgusting Right Now,1
A Historic Summit: Donald Trump Just Finished A Marathon Day Of Diplomatic Talks With A Man In A Freddy Krueger Costume Who Introduced Himself As The King Of Scotland,1
How Many Of These MTV Dating Shows From The Early 2000s Have You Watched?,1
Teen Pregnancy Rate Prompting More High Schools To Eliminate ‘Fuck Your Brains Out’ Program,1
"In Wake of Jacksonville, Florida Passes Strict Ban on Being Unarmed",1
"New ‘Game of Thrones’ Teaser Shows Cackling, Power-Mad George R.R. Martin Burning Completed ‘Winds Of Winter’ Manuscript",1
Rafael Nadal Reminds Self It Called ‘Football’ Over There,1
High School Bully Ready To Unload Summer Vacation’s Worth Of Abuse,1
Kroger Phasing Out Plastic Bags By 2025,1
He Is Obviously More Important!,1
Report: John Lennon Probably Would Have Eventually Died Anyway,1
Ultimate Disrespect: The White House Is Still Flying Its Flag Depicting John McCain Being Confused By A Pinecone,1
Researchers No Closer To Understanding What The Fuck You’re Talking About,1
Juul Unveils Sleek New E-Smoker,1
Florida Passes Strict Ban On Being Unarmed,1
Poor lost cars 😢😞,0
Texas Sheriff Blasts Immigrant ‘Drunks’—Then Son Is Busted for Public Intoxication,0
Ever played a game of roll ball? Neither has the team representing Canada at the Roll Ball World Cup | CBC News,0
Parents say adopted 8-year-old was actually woman with dwarfism who tried to kill them,0
A Hong Kong Woman Just Got Convicted of Assaulting a Police Officer With Her Breast,0
“Sesame Street takes on opioids crisis as muppet’s mother battles addiction”,0
Pedophile walks over 350 miles and gets busted by an undercover cop.,0
The Uprising,0
"Superintendent says 'whiteout' T-shirt fundraiser is racially 'insensitive,' shuts it down",0
"IRS: Goto Jail for Depositing Cash in ""Wrong"" Amounts",0
"New York woman pays off $102K in student loans, celebrates in cemetery",0
Locsin apologizes to China for taking Mao Zedong's name 'in vain',0
Indiana Man Walked 351-Miles To Have Sex with 14-Year-Old Girl: DOJ Says,0
The World Needs More Visionaries Like Elizabeth Holmes,0
"Superintendent says 'whiteout' t-shirt fundraiser is racially 'insensitive,' shuts it down",0
North Carolina assisted living facility workers accused of running dementia resident fight club,0
College professor says 'SpongeBob SquarePants' is violent and racist,0
PM's confidential talking points inadvertently sent to journalists,0
"Superintendent cancels student-organized “whiteout” soccer fundraiser, says the word white is offensive",0
California high school football player tackles teammate after interception for going the wrong way,0
Republican Congressman Tweets Image Of Russian Warship To Wish US Navy Happy Birthday,0
Republican Congressman Tweets Out Image Of Russian Warship To Wish US Navy Happy Birthday,0
Dementia Fight Club,0
Vegan woman goes to police after friends feed her chicken nuggets while she's drunk,0
Every player on Oklahoma and Texas gets unsportsmanlike conduct penalty before kickoff,0
"Jennifer Lopez hit with $150,000 lawsuit for posting a photo of herself and fiancé on Instagram",0
india satalite usage,0
"Home Office gives a two-year-old 14 days to leave the country or face deportation, despite the fact that both her parents have British citizenship and the girl has no family in South Africa",0
Fed govt blunder: talking points revealed,0
Man Walked 351 Miles To Have Sex With Teen Who Turned Out To Be An Undercover Cop,0
Black woman shot dead by Texas police through bedroom window,0
Queensland teacher passes out in front of grade-two class while drunk on vodka,0
School Officials Deny That Autistic 5-Year-Old Was Labelled 'Sexual Predator' After Hugging Classmate,0
Texas Sheriff Blasts Immigrant ‘Drunks’—Then Son Is Busted for Public Intoxication,0
A FIVE-YEAR-OLD BOY with autism has been branded a sex offender after he hugged a classmate and kissed another on the cheek at an elementary school in Tennessee.,0
"Boy, 5, with autism 'put on record as sex offender’ after hugging classmate",0
You couldn't write it,0
🥓 Spree,0
Five-year-old autistic boy ‘put on record as sex offender’ after hugging classmate,0
“Pope Francis Accidentally Tweets Support for New Orleans Saints“,0
Squirrel Stores 200 Walnuts Under Car Hood in Pittsburgh | The Weather Channel,0
"Indiana man walks 351 miles to have sex with 14-year-old girl in Wisconsin, police say",0
"School superintendent shuts down student-organized “white-out” fundraiser, says the word white is offensive",0
Man walks 351 miles from Indiana to Wisconsin to meet 14-year-old girl for sex: authorities,0
A woman in her 70s has died after she was accidentally dropped 40m (131ft) from a helicopter rescuing her from an area devastated by Typhoon Hagibis,0
