title,source
"'Buddhist aliens' have visited 'Thailand’s Area 51' and predicted World War 3 - ""Police have tried to shut down UFO cult, and say they’ll arrest aliens if they can""",1
Disturbing: This Man Is Wearing Socks In The Grass,1
Bold Move: Hulu Has Announced That They’re Gonna Go Ahead And Reboot ‘Shrill’ While It’s Still On Since You Idiots Will Watch Anything,1
Gun Control Fail: This Duck Found A Gun In A Bush And Is Now Pushing It Around The Park With Its Beak,1
3M Releases Command Self-Adhesive Meat Hooks For Serial Killers Trying To Reduce Clutter,1
Movie Theater Security Reports Suspicious Behavior After Patron Buys Ticket To ‘Gemini Man’,1
"Preview: ‘Pokémon Sword and Shield’ Is Sadly Marred By The Addition Of Sponsored Content Pokémon Like Boo Berry, Pep Boy Moe, And Florida Orange",1
BREAKING: Some Bullshit Happening Somewhere. Old but still awesome.,1
"‘They Can’t Arrest Both Of Us,’ Says Giuliani Handcuffing Himself To Times Square Pikachu",1
Might As Well Forfeit: The Girls On The Other Volleyball Team All Have Matching French Braids,1
"Now That’s What We Like To See: When Jesus And Satan Both Tried To Lure This Toddler Into Their Minivans, The Toddler Chose To Get Into Jesus’s Minivan",1
Prince filip sworn as queen after shocking death of elizabeth the 2nd,1
"‘At Least They Don’t Know About My Leaking, Prolapsed Anus,’ Thinks Devin Nunes Filing Lawsuit Against Mocking Twitter Accounts",1
Donald Trump Quits Twitter! Blames Left for Cyberbullying,1
Trump Assures Kurds There Will One Day Be Very Nice Tree Planted In D.C. Commemorating Their Deaths,1
GOP Lawmakers Watch Silently As Trump Strangles Each Of Their Loved Ones In Turn,1
"Heartbreaking: When This Man’s Wife Gave Birth To A Baby That Looked Exactly Like Him, He Realized That She Had Been Having An Affair With His Twin Brother",1
Dallas Cops Plant Black Suspect At Murder Scene,1
Here Are Some Of My Husbands And Some Of My Vegetables In No Particular Order,1
Skip Bayless Slams History Of Chinese Post-Opium War Intervention Anxiety In 6-Hour ‘Undisputed’,1
Job-Hunting Jay Gruden Frantically Scrubs Social Media Of Anything Associated With Redskins,1
Wheelchair-Basketball Players Stunned By Thunderous Slam Dunk,1
"In Major Blow To Sony’s Upcoming PlayStation 5, Microsoft Announces PlayStation 6",1
Don’t Click! Snakes!,1
Chinese Officials Respond To NBA Controversy By Moving Millions Of Citizens To NHL Re-Fanification Camps,1
GOP Lawmakers Watch Silently As Trump Strangles Each Of Their Loved Ones In Turn,1
How Can We Make The War In Iraq More Eco-Friendly,1
Man Starting To Think He Didn’t Win 1995 Kellogg’s Frosted Flakes Sweepstakes For Free Trip To Australian Outback,1
Outstanding move,1
Jeopardizing The Deal: This Man Keeps Excusing Himself From An Important Business Dinner So He Can Go To The Bathroom And Look At His ‘Avengers’ Underwear,1
Law School Applications Increase Upon Realization That Any Fucking Idiot Can Be Lawyer,1
Ditch The Personal Trainer: 5 Pretty Bad Stretches You Can Do At Home,1
Heartwarming: Lionel Richie And Chewbacca Mom Have Buried The Hatchet After Realizing Life Is Short And They Don’t Even Know Each Other,1
Report: It's Not Okay To Just Start Talking To People You Don’t Know,1
‘Are You The Whistleblower?’ Trump Boys Ask White House Janitor After Giving Him Serum Of All The Sodas Mixed Together,1
What's the piece that begins at 0:48?,1
"‘No Way To Prevent This,’ Says Only Nation Where This Regularly Happens",1
FBI Warns ‘Downton Abbey’ Screenings Could Be Target For Shootings By Disgruntled Royalist,1
Nation’s Top Pseudoscientists Harness High-Energy Quartz Crystal Capable Of Reversing Effects Of Being Gemini,1
Vontaze Burfict Expresses Deep Regret For Letting Jack Doyle Live,1
Trump Furiously Searching Raytheon Catalog For Gift After Realizing He Promised China And Ukraine Same Javelin Missile,1
Nation Ashamed To Admit They Would Probably Look Up John Goodman’s Nudes If They Leaked,1
An oldie but an absolute goodie. One of my all time favorites deserves some respect,1
"Giuliani: ‘When The Going Gets Tough, I Can Always Look Back Fondly On The Events Of 9/11’",1
Incredible Devotion: This Tibetan Monk Remembers To Do His Meditation App Almost 5 Days A Week,1
Cool It: This High Schooler Is Really Milking The Fact That Her Birth Control Alarm Just Went Off In The Middle Of Class,1
This article from 2011 should be archived as a classic,1
Kamala Harris Undergoes Heart Surgery After Seeing Positive Reception For Sanders,1
6 Pictures Of Scarlett Johansson That Will Make You Say ‘This Is A Picture Of A Boat’,1
Justin Trudeau Explains Deep Spiritual Significance Of Oil Pipelines Through Indigenous Lands,1
Fisher-Price Recalls Dangerous 30-Foot-Tall High Chair,1
"‘Please Guide Me In My Darkest Hour Lord,’ Prays Trump Kneeling Before Portrait Of Himself",1
‘Seinfeld’ Producers Reveal They Originally Planned To Kill Off Jerry In The Pilot,1
More People Should Have Donated: Wikipedia Has Announced They Will Be Forced To Take Down Their Entry For ‘Ostrich’ Due To Lack Of Funding,1
Crime Scene Has All The Different Types Of Cops,1
So Annoying: Every Time This Man Visits Home His Family Hounds Him About When He’s Going To Get Into An Ethically Non-Monogamous Relationship,1
Way Too Fucking Soon: The Cast Of ‘Angie Tribeca’ Just Came Together For An Incredibly Emotional Reunion,1
'Are You The Whistleblower?' Trump Boys Ask White House Janitor After Giving Him Serum Of All The Sodas Mixed Together,1
New Pumpkin Spice Channel To Offer Fall-Themed Hardcore Pornography,1
The Onion called it: America Needs a Moat (...filled with alligators),1
Mother Feels Violent Desire To Make Front Doorway Reflect Current Season,1
Police Union Decries Egregious Carriage Of Justice In Amber Guyger Murder Conviction,1
Nutritionists Report They Wouldn’t Have To Figure Out Which Foods Were Bad For You If Americans Just Ate Normal For Once,1
15 Episodes Of ‘Seinfeld’ When Jerry Dated A Woman With Man Hands,1
my dude really ate the onion here. Kraft singles at a movie theatre bro?,1
"Ah yes, there's nothing I love more than buying some Kraft slices at my local theater",1
Could Go Either Way: The Kid Who Just Turned In His Test 30 Minutes Early Is Either A Genius Or An Absolute Dumbass,1
Rock Climber Dies Doing What He Was Kind Of Into For 6 Months,1
TSA To Phase Out Glue-Sniffing Dogs,1
Mitch McConnell Dodges Reporter’s Question By Quickly Stepping Into Empty Elevator Shaft,1
Child Pointing Out Cow On Side Of Road Must Think Parents Don’t Have Fucking Eyes,1
Trump Aides Investigating Whistleblower Struggling To Identify Single Person In CIA With Moral Principles,1
Authorities Theorize Santa Anita Race Track Deaths Could Be Work Of Horse Serial Killer,1
Piling On: Lysol Is Following Microsoft’s Lead With A Series Of Ads Absolutely Dunking On MacBooks,1
Deal Alert: Your Parents Have Promised To Buy You ‘Let’s Go Pikachu’ If You Can Make It Through Rosh Hashanah This Year Without Biting Anyone,1
Absolutely Heartbreaking: This Guy Who Just Got Laid Off Believes It’s The Universe’s Way Of Telling Him To Pursue His Dream,1
‘New York Times’ Offers To Disclose Whistleblower Identity To Readers Who Subscribe In Next 24 Hours,1
Mitch McConnell Dodges Reporter’s Question By Quickly Stepping Into Empty Elevator Shaft,1
New Hellmann’s Theme Park To Feature World’s Longest Lazy Mayo River,1
Slide-Whistleblower Complaint Reveals Trump’s Pants Around Ankles,1
Aging Tom Cruise No Longer Able To Climb Outer Wall Of Skyscraper Without Taking Break Halfway Through,1
How Gentrification Works,1
"Woof, Just Brutal: The 10 Shittiest Shows On PBS",1
Dating Win! Netflix Has Added A New Date Night Feature That Puts Several Half-Watched Ken Burns Documentaries In Your ‘Continue Watching’ Section To Make You Seem Smart,1
Disoriented Amber Guyger Opens Fire After Mistakenly Entering Wrong Courtroom,1
Nintendo Releases New Mario Kart Sedan Controller,1
Lindsey Graham Demands To Know How Trump Supposed To Lead Nation Under Such Rampant Accountability,1
Retail Employee Has Little Daily Ritual Where He Drinks Dr. Pepper In Quiet Corner Of Stock Room And Doesn’t Kill Himself,1
This is the reason I told my mum not to get a labradoodle,1
"Chelsea Manning, Reality Winner Excitedly Hoping Nation’s Newfound Approval Of Whistleblowers Will Get Them Out Of Jail",1
Rudy Giuliani Calls In To Talk Show He Already On To Deny What He Just Said,1
Unlucky In Love: 4 Times Regis Philbin Got Voted Off ‘The Bachelorette’ In The First Episode Of The Season,1
"Man Sure Is Glad He Switched From E-Cigs To Regular, Healthier Cigarettes",1
D.C. Visitors Impressed By Statue Honoring Nation’s First Obelisk President,1
Nation’s Labradoodles Begin Combusting After Regretful Creator Initiates Self-Destruct Sequence Programmed Into Their DNA,1
Sean Spicer’s Agent Tells Him If He Calls Trump’s Conduct ‘Troubling’ She Could Probably Get Him On ‘American Ninja Warrior’,1
Home Depot Introduces New 100-Pound Bag Of Mulch For Fucking Up Back In Garden Section,1
Mattel Preempts Backlash Over Gender-Neutral Doll With Release Of New ‘Covered In Genitals’ Barbie,1
How About We Go Outside And Settle This Like Emotionally Stunted Men?,1
Resistance Democrat Racking Brain For Way To Sexualize Anonymous Whistleblower,1
Experts Recommend Families Have Plan For Ditching Weakest Member In Case Of Disaster,1
Brewers Players Showering Themselves In Beer Unaware They Clinched Playoff Spot,1
Authorities Hunt For Arsonist Suspected Of Purifying Dozens Of Buildings In Bath Of Glorious Flame,1
A Piece Of History: The Beautiful Velvet Ribbon That Made JFK’s Head Fall Off When It Was Untied Is Coming To The Smithsonian,1
Trump Opens Door On Air Force One Again,1
"Hey guys, I thought you lot would appreciate the technology section of the onions website from September 13th 2001.",1
Pope Francis On Vatican Abuse Scandal: ‘Just Tell Me Whose Feet To Wash’,1
This Just Serves To Illustrate Science Teacher’s Point About Safety,1
New Fitness Tracker Monitors Amount Of Exercise Users Watch On TV,1
Fighting Impeachment: Trump Has Had Barron Bury Him Up To The Neck In The White House Lawn So That He Cannot Be Removed From Office,1
Botox Criticized For New Ad Campaign Targeting Millie Bobby Brown,1
Trump Approval Rating Surges To 98% Immediately Following Nancy Pelosi Opening Impeachment Proceedings,1
NFL Reaffirms Commitment To Player Safety By Eliminating QB Position,1
White House Unveils Lightly Edited Memorandum Of U.S. Constitution That Specifically Declares Trump’s Innocence,1
"Weak, Exhausted Nancy Pelosi Given Saline Drip Following Hours-Long Attempt To Stand Firm In Convictions",1
Heartbreaking: The Smiling Selfie Grandma Uploaded To Reddit Just Became The Most Downvoted Post In History,1
Something For The Foot Fetish Crowd: This Foot Wants To Have Sex With You!,1
Pros And Cons Of A 4-Day Workweek,1
-,1
Fall cancelled after 3 billion seasons,1
Beto O’Rourke’s Son Concerned Trump Will Order Ukraine To Investigate Him Next,1
Preview: ‘The Last Of Us Part II’ Will Explore Ellie’s Character Growth As She Focuses On Self-Care By Hiking And Taking A Pottery Class After Realizing She Can’t Control The Infected Around Her,1
Hitman 2’s New Tropical Resort DLC Lets You Quit Being An Assassin And Become An Ornithologist For The Remainder Of The Game,1
Just Call The Whole Thing Off: The Instagram Post Announcing This Couple’s Engagement Only Has 16 Likes And A Spam Comment,1
Dodged A Bullet: Grandma Is Going In For A Surgery This Week But It’s Not A Serious One So You Don’t Have To Call Her Or Visit Her Or Anything Like That,1
Pope Breaks Ice At Clergy Abuse Summit By Having Everyone Go Around And Say How Many Kids They Molested,1
Aging Mother Threatens To Get Some Sperm And Shoot It In Daughter’s Womb Herself If She Doesn't Hurry The Fuck Up,1
Oprah Invites Hundreds Of Lucky Fans To Be Buried With Her In Massive Tomb,1
8.106,1
Nation Perplexed By 16-Year-Old Who Doesn’t Want World To End,1
College Basketball Star Heroically Overcomes Tragic Rape He Committed,1
Viewers Disappointed New ‘Frozen 2’ Trailer Provides Almost No Clues To The Specifics Of Trump’s Conversations With Ukrainian President,1
House Democrats Issue Condemnation Of Ukraine For Making It Harder To Avoid Impeaching Trump,1
Years Of Playing Tower Defense Games Can’t Prepare You For The Responsibilities Of Defending A Real Tower,1
No Other Options: The Writers Of ‘The Simpsons’ Have Announced That They Have Exhausted All Other Character Story Combinations And Must Resort To A Romantic Relationship Between Homer And Bart,1
Extremely Embarrassing: This Woman’s ‘Crazy Frog’ Ringtone Keeps Going Off In The Middle Of Her Own Funeral,1
Vatican Forced To Revoke Dozens Of Sainthoods After Discovering Miracles Performed With Eldritch Magic,1
Rob Gronkowski’s Wife Gets Out Photo Album To Prove To Him He's Met Tom Brady,1
Do we allow the Beaverton here?,1
"Joe Kennedy Dodges Crashing Planes, Swerving Cars After Announcing Campaign For Senate",1
Chiefs Trainer Squirts Bottle Of KC Masterpiece Into Andy Reid's Mouth,1
"Holy Shit, Toddler Just Face-Planted Right Onto Sidewalk",1
Golden Retriever Mauls 5 In Huge Victory For Pitbull Apologists,1
"‘Ni No Kuni’: Remastering Done Right, But Gameplay Is Marred By My Newborn Son's Constantly Screaming",1
Completing The Tribute: The U.S. Government Has Finally Finished Constructing The 30-Foot Barber That's Cutting Lincoln’s Hair In The Lincoln Memorial,1
Awesome: Home Depot Is Now Selling An Incredibly Weak Pepper Spray You Can Use On People Who Are Annoying But Not Dangerous,1
Overwhelmed Dolphins GM Ask Players To Please Use Automated Email Form When Making Trade Requests,1
Rookie Forest Ranger Not Getting Hopes Up About Seeing Tree On First Day,1
Parents Assure Scared Child There’s No Such Thing As Skip Bayless,1
"Stunning Intelligence: For The First Time Ever, Scientists Have Observed A Chimpanzee Blow Up A Human Child With Its Mind",1
NFL Pre-emptively Adds Whatever Bullshit Gronk Hawking To Banned Substance List,1
Pompeo To Increase Bombing In Afghanistan After Figuring They’ll Miss And Hit Iran At Some Point,1
Home | Russian hackers manipulate recipe for vaccines,1
Grandmother Contracts Herpes 5 Minutes After Checking Into Nursing Home,1
Trump Orders Presidential Motorcade To Take Detour Through Homeless Encampment,1
Justin Trudeau Responds To Blackface Criticism With New ‘Triggered?’ Campaign Slogan,1
Not As Heartwarming As It Could Have Been: Anthony Hopkins Just Showed Up At This High School 8 Months Early To Ask A Girl With A Temporary Neck Brace To Prom,1
Retail Employee Has Little Daily Ritual Where He Drinks Dr. Pepper In Quiet Corner Of Stock Room And Doesn’t Kill Himself,1
We Ranked Anime's Top 10 Static Shots of Power Lines With Cicada Noises,1
How Do Archers Resist Firing Arrows At Everyone In The Spectator Gallery?,1
Major Security Crisis: The Rooster That’s Loose In The White House Is No Longer Afraid Of The Jack-O’-Lantern President Trump Put Outside The Oval Office To Scare It Away,1
"Okay, Ladies, Now Let’s Get In Formation: 5 Ridiculously Fun Bachelorette Party Destinations Where You Can Lap Up Gallons Of Cola And Rip Ass With Your Best Gals",1
"Philadelphia To Become DirecTV, PA After Cream Cheese Manufacturer Loses Naming Rights",1
Patrick Stewart Spends Morning Shaving Beautiful Golden Locks That Grow On Head Every Night,1
School Shooter Thankfully Stopped Before Doing Enough Damage To Restart National Gun Debate,1
Dolphins Fan Starting To Think Brian Flores Not Chief Architect Of Patriots’ Success,1
"Philadelphia To Become DirecTV, PA After Cream Cheese Manufacturer Loses Naming Rights",1
Damn,1
MASSIVE SEMEN EXPLOSION AFTER BLAZE HITS BULL ARTIFICIAL INSEMINATION FACILITY,1
"Massive semen explosion after blaze hits bull artificial insemination facility, firefighters forced to dodge ""projectiles""",1
Onion Explains: Putin's Russia,1
Disgusting Freak: This Man Has An Entire Room In His House Dedicated To Urinating And Defecating,1
4 Times On ‘Friends’ When They Really Made The Laughing Launch Out Of Our Mouths,1
Ben Roethlisberger Assures Women Of Pittsburgh He Not Done Yet,1
"Game’s 5,000 Hours Of Written Dialogue Spread Over 200 Side Quests And 6 Branching Endings Derided As Rushed, Repetitive",1
Metric System Thriving In Nation's Inner Cities,1
BREAKING: Kyle Acting Like Petulant Little Shit In 3rd Period,1
Obvious Nepotism: This 5-Year-Old Boy Was Just Appointed Grocery Shopping Helper By His Own Parents,1
Tensions Mount After North Korea Destroys All Of Asia,1
It's true,1
U.S. Government Stages Fake Coup To Wipe Out National Debt,1
Panel Of Caged Average Americans Weigh In On Economy,1
New Prius Helps Environment By Killing Its Owner,1
Congress Forgets How To Pass A Law,1
GameStop Somehow Selling Used Version Of Game Day After It Comes Out,1
Emotional support clown,1
Joe Biden Hitchhikes To Democratic National Convention,1
Report: Every Potential 2040 President Already Unelectable Due To Facebook,1
Thought I was in this subreddit for a second,1
Pros And Cons Of Binge-Watching,1
"I did the art and headline, now please write the article",1
The Onion Reviews 'Ghostbusters',1
Harvard Officials Say $8.9 Million Donation From Jeffrey Epstein Was From Brief Recovery Period When He Wasn’t A Pedophile,1
"Bold Strategy: Gatorade’s New Ad Campaign Pushes The Notion That Dumping Gatorade On People Is Something You Should Do When You’re Sad, Too",1
Moderator Jorge Ramos Asks Candidates How They Would Help Struggling Media Companies With $7.5 Billion Of Debt,1
Roger Goodell: ‘It Nearly Impossible For League To Keep Up With Crimes Regularly Committed By NFL Players’,1
Liberal Parents Struggling To Find School District With High-Quality Drag Queens,1
Green Giant Offering Program Where Gun Owners Can Trade In Firearms For Green Beans,1
Tips For Playing ‘Borderlands 3’,1
Corporate Disaster: The CEO Of Trojan Held A Press Conference With His 300 Children To Issue An Urgent Recall On All Trojan Condoms,1
Weather Channel Accused of Pro-Weather Bias,1
Biden Complains Moderators Keep Giving Him Ample Time To Speak,1
Marianne Williamson Materializes On Stage In Cloud Of Purple Smoke With Message That DNC Polling Requirements No Match For Power Of Positive Thinking,1
Tearful Justify Holds Press Conference Blaming Failed Drug Test On Contaminated Salt Lick,1
Sam Darnold’s Mono Diagnosis Forces Jets To Crack Down On Kissing In Huddle,1
A Beautiful Tribute: This Woman Is Using An American Flag-Themed Disposable Napkin In Honor Of Her Country,1
Inspiring: Thousands Of Gamers Have Pitched In To Rescue Consoles Abandoned In The Wake Of Hurricane Dorian,1
Major Setback: NASA Has Cancelled Plans To Go To Mars Because They Can't Find Anything Cute To Wear,1
LEGO Unveils Line Of Playsets Commemorating Children Who Choked To Death On One Of Their Blocks,1
U-Haul Introduces New Catapult Rental Service,1
New Biblical Evidence Reveals Christ Suffered Extensive Brain Damage During Time Lying Dead In Tomb,1
"Hong Kong, Chinese government infuriated with Berlin. The German foreign minister shook hands with activist Joshua Wong",1
U.S. Border Patrol Increases Staff By Hiring Cheap Immigrant Labor,1
Apple Introduces Revolutionary New Laptop With No Keyboard,1
We Did Not Have The Time To Reimagine Kermit The Frog. Here He Is Normal.,1
Cheney Waits Until Last Minute Again To Buy Sept. 11 Gifts,1
Nation Solemnly Recalls Horrors of 9/11 15th Anniversary,1
Nation Solemnly Recalls Horrors of 9/11 15th Anniversary,1
4 Icy Hot Commercials Where It Was Extremely Clear Shaq Thought Icy Hot Was Dog Repellent,1
Someone Built A World In ‘Minecraft’ Where 9/11 Never Happened And It’s Incredible,1
Hijackers Surprised To Find Selves In Hell,1
American Life Turns Into Bad Jerry Bruckheimer Movie,1
Congress Honors 9/11 First Capitalizers,1
Issue 37•34,1
All Of Nation's Living Presidents Gather To Lie About Bush Presidency,1
House Democrats Vow To Hold President Accountable With Agriculture Bill Where First Letter Of Every Line Spells Out ‘Impeach Trump’,1
Thousands Of Girls Match Description Of Missing Sorority Sister,1
New iPhone 11 Has 5 Built-In Full-Size Polaroid Cameras,1
America Ends Negotiations With Bloodthirsty Warlord: A Look Back At John Bolton's Time In The Trump Administration,1
Indianapolis Motor Speedway Forced To Lower Speed Limit To 20 MPH After Elementary School Opens Next To Straightaway,1
Hopefully This Article Where We Call Desmond Tutu ‘The Ultimate Bimbo’ Offends Enough People To Get Us Some Valuable Hate Clicks,1
"Stephen A. Smith Retreats To Tranquil, Secluded Fig Tree To Contemplate On Meaning Of NFL Week One",1
John Bolton Consoles Self That At Least He Didn’t Help To Make World Safer Place,1
"Mad With Power: The Drama Teacher Is Making Everybody Come In On A Saturday To Paint A Shitty Looking Wall That Says ‘STORE’ For The ‘Hello, Dolly!’ Backdrop",1
Real Life ‘DOOM’: This Office Requires A Keycard To Get In,1
Liberty University Board Concerned Falwell’s Corruption Risks Undercutting College’s Mission Of Subjugating Women And Gay People,1
Onion News Empire Official Trailer,1
Maths student about to marry… her Tetris game,1
Jerry Falwell Jr. Tells Story Of Jesus Getting Revenge On Apostle Who Ratted Out His Corruption Schemes,1
"Not Very Scary, Honestly: This Little Girl Is Possessed By The Spirit Of A Normal Guy",1
"Whoa, Is That The Same Guy? This History Teacher Got Crazy Hot Over The Summer After Finally Going Through Puberty",1
New Subway Promotion To Honor Subtember 11,1
Here’s Everything We Know So Far About ‘Super Mario 64’,1
5 Risky Teenage Behaviors That Would Honestly Be A Way Better Use Of Your Kid’s Time Than Joining Color Guard,1
Special Boy With Freakishly Large Brain Wins Spelling Bee,1
Onion Social CEO Embarks On Tour Of Several Coffee Shops Near Where He Lives,1
Nation’s 30-Year-Olds Pool Money To Buy 2-Bedroom Bungalow Together,1
Nation’s Bison Hold Lavish Fundraiser In Effort To Get 2020 Candidates To Support Environment,1
The 6 Best Things About Being In Hell Forever,1
10/10 would reccomend,1
Behold: The Children Of Others,1
New Ad Urges Hipsters To Go To Applebee's Ironically,1
Following His Heart: Nick Jonas Fell In Love With The Horny Old Lady Who Bid On A Date With Him At A Charity Auction And Now He Is Leaving His Wife,1
OGN Is Retracting Its 9.3/10 For ‘Gears 5’ After Realizing We Haven’t Gotten A Single Dollar From Microsoft,1
DEA Recruits Lil Wayne To Use Up All Drugs In Mexico,1
Inclusive New Texas Bill Prevents Gun Sellers From Discriminating On Basis Of Background Check,1
Joe Pesci So Sick Of Fans Asking To Blowtorch Scalp For Photo Op,1
Marianne Williamson Deletes Tweets About Using Mind To Control Weather After Realizing Nation Unprepared To Wield Such Great Power,1
Kim Kardashian Tries To Escape L.A. In Rowboat After Realizing Past 12 Years Of Life Have Been TV Show,1
So Annoying: This Woman Who’s Doing All The Steps Wrong In A Zumba Class Is Really Getting In The Way But She’s Too Elderly For The Teacher To Do Anything About It,1
Jo Johnson resigns as Tory MP to spend less time with his family,1
Biden Campaign Concerned After Candidate Gives Unsolicited Back Rub To Coat Rack,1
Fascinating: The CEO Of McDonald’s Has Revealed That Grimace Is The Larval Stage Of Ronald McDonald,1
Blast From The Past: This Building Kind Of Looks Like A GameCube,1
Gunman Kills 15 Potential Swing Voters,1
Study Finds Girls Go Through Manga Phase Earlier Than Boys,1
New Even Bleaker ‘Joker’ Reboot Features Elderly Comic Book Villain Struggling To Care For Wife After Stroke,1
New Alternate-History Drama Examines What Would Have Happened If Nazis Won 1991 NBA Finals,1
"Mods asleep, post actual onion",1
Colorado Boy Asks Nation Not To Find His Missing Little Brother,1
"Major Mishap: Colorado Just Tried Restoring Voting Rights To 30,000 Felons But Accidentally Gave Jared Fogle The Right To Vote 30,000 Times Instead",1
Baffling: This Woman’s 6-Paragraph Facebook Post About Gratitude Accompanying A Professional Headshot Of Her In A Cornfield Doesn’t Seem To Have Any Kind Of Big Announcement In It,1
DNA Evidence Frees Black Man Convicted Of Bear Attack,1
Bush Regales Dinner Guests With Impromptu Oratory On Virgil's Minor Works [gem from 7/06/05],1
Nation’s Nonfiction Writers Announce Plans To Keep Writing Down Things That Happened,1
Weebs now have the right to conceal carry within VR Chat,1
Walmart Discontinues Auto Part Sales To Prevent Car Accidents,1
Obamas Sign Exclusive 6-Truck Deal To Produce Series Of Mid-Size RAM Pickups,1
"Lean In, Queen! Her Husband Told Her The Only Room Off Limits In His Accursed Estate Was His Private Study, But She Went In Anyway And Totally Owned Her Horrible Fate",1
Incredible Discovery: Oxford Researchers Have Determined That King Tut Would Have Been Their Best Friend,1
The 6 Best Things About Being In Hell Forever,1
‘Help! Help! Who Am I? Where Am I? Who Are You People?’ Says Biden In Embarrassing Campaign Gaffe,1
New Ad Urges Hipsters To Go To Applebee's Ironically,1
Unconscious Amazon Employee Chastised For Not Filing Time-Off Request,1
Deal Alert: A Beluga Whale Beached Itself With A Stomach Full Of Classic N64 Cartridges,1
"Democrats Launch New ‘Listen Up, Hayseeds” Campaign To Connect With Rural Voters",1
Torn Apart By Grief: This Couple Was Unable To Save Their Marriage After The Death Of Verne Troyer,1
Going Too Far?: Nintendo Has Responded To Complaints That Marth Is Too Overpowered In ‘Smash’ By Giving Him Fibromyalgia,1
Hurricane Ashley Expected To Strike Several Bars This Cinco De Mayo,1
Behind The Pen: The Chinese Threat,1
