title,source
Heartbreaking: This Kid Genuinely Seems Pretty Proud After His Teacher Announced That His Section Of Biology Is A Full Week Ahead Of Her Other Bio Classes,1
Real Life Incredible Hulk: This Man Turns Green And Goes Bald Every Time He Gets Upset,1
Scientists Discover Mollusks Are Next Evolutionary Stage For Humans,1
Beauty Industry Announces Massive New Initiative To Make Women Self-Conscious About Their Palms,1
Mom Figures It About Time To Sit Down Adolescent Daughter And Explain How Weight Watchers Points Work,1
Car Parked With Windshield Wipers Halfway Up Offers Glimpse Of World Suspended In Time,1
Gay Pride Parade Sets Mainstream Acceptance Of Gays Back 50 Years,1
Shutdown Cost U.S. Economy $11 Billion,1
Parents’ Visit Injects $66 Into Local Apartment Economy,1
Jimmy Carter Concerned Desire For Fresh Faces In Democratic Party May Hurt His Chances In 2020,1
"‘It’s Just A Plant, Man,’ Says Purdue Pharma CEO Waving Poppy Flower Before Opioid Lawsuit Judge",1
Democratic Presidential Candidates Endorse New ‘Medicare For All’-Branded Cigna Insurance Plan For Only $400 Per Month,1
Nothing Fancy Here: 6 Normal Hairstyles,1
First Automated Foxconn Machine Immediately Tries To Commit Suicide,1
You’ll Never Learn To Love Your Body Unless You Come Do Chores Around My Yard,1
Parenting Experts Warn Screen Time Greatly Increases Risk Of Child Becoming An Influencer,1
Competition For 23AndMe? This New Company Lets You Send Them Your Saliva And They Will Tell You If They Like It,1
Bob Barker Said What?!,1
Tips For Getting Unsafe Elderly Drivers Off The Road,1
Parents’ Visit Injects $66 Into Local Apartment Economy,1
Art Of The Craft: Former Burglar Shares His Secrets For Breaking Into Homes,1
David Crosby Shows Photo Of Dwarven Blacksmith To Barber To Give Idea Of What He Wants,1
Cop Just In It For The Frisking,1
Record-Breaking Cold Grips Midwest,1
"BREAKING: Daniel Throwing His Life Away, You Should Call Him, He Dropped Out Of Wharton—Wharton, For God’s Sake",1
Inclusivity Win! Marvel Is Changing The Sound That Spider-Man’s Web Shooters Make From ‘Thwip’ To ‘Mixed-Race Families’,1
Dave Grohl Said What?!,1
Please help us out.,1
Inspiring Determination: This Man Was Stranded At Sea For 151 Days And Survived Almost The Entire Time,1
Jimmy Carter Concerned Desire For Fresh Faces In Democratic Party May Hurt His Chances In 2020,1
Justin Trudeau Unveils Plan To Meet Healthcare Needs Of Canada’s Aging Prog Rockers,1
"I Used To Be Pro-Gun Control. But Now...I Think I’m Gonna Hurl, You Guys!!!",1
T-Mobile Announces Wireless Service Now Covers 70% Of Your Apartment,1
New ‘Game Of Thrones’ Trailer Confirms Season 8 Will Reveal Identity Of Sword-Covered Chair,1
Roger Stone Open To Cooperating With Mueller,1
Man’s Wife Dies Of Cancer Just Like In The Movies,1
Super Bowl LIII: Key Storylines To Watch,1
Frigid Chicago Bean Shrivels Up From Below-Zero Temperatures,1
Mild-Mannered Reporter Suddenly Transforms Into Incredible Unemployed Man,1
Alcoholic Father Granted Posthumous Sainthood By Catholic Family,1
"Lost Jack London Manuscript, ‘The Doggy,’ Found",1
U.S. And Taliban Agree To Framework For Peace Deal,1
Kristen Stewart Said What?!,1
Minnesota Resident Thinking Of Finally Packing It All Up And Moving Someplace Warm Like Michigan,1
5 Things To Know About Howard Schultz,1
"Dick Cheney Finally Hunts Down, Kills Man He Shot In Face In 2006",1
Sean McVay Reveals Bill Belichick Occasionally Texted Him Photos Of Dead Animals After Games,1
Whoa: Morgan Hung Up String Lights In Her Jail Cell,1
Report: Bananas Still Most Popular Fruit For Pretending To Receive Phone Call,1
Sex-Ed Fail: This Texas Public School Has Fired The Goat-Headed Man Who Lures Students Into The Forest To Show Them A PowerPoint About Safe Sex,1
Older Cafeteria Monitor Not A Teacher Or Parent Or Anything,1
"‘Follow Your Instructions, This Is All Part Of The Plan,’ Hisses Richard Nixon Tattoo Protruding From Roger Stone’s Back",1
Beautiful Cultural Exchange: This German Student Visiting An American High School Shouted ‘My Eggs!’ After He Got Hit In The Testicles With A Football,1
Matter Of Life And Death: First Responder Describes His Most Intense Rescues,1
Report: Mueller Investigation Nearly Done With First Day Of Trump Campaign,1
Coolest Job Ever: This Awesome Digital Media Company Hired Post Malone To Entertain Laid-Off Employees With Amazing Music While They Cleaned Out Their Desks!,1
"‘Follow Your Instructions, This Is All Part Of The Plan,’ Hisses Richard Nixon Tattoo Protruding From Roger Stone’s Back",1
Common Morning Habits Of Successful People,1
Sequel To Original ‘Ghostbusters’ Being Made,1
Man Losing Respect For Incompetent Boss Who Won’t Fire Him,1
Indignant Bill Belichick Evades Question By Cutting Off Reporter’s Tongue,1
"Disney Announces ‘Kingdom Hearts III’ Will Feature Ernest, Turner, Hooch, And All The Rest Of Your Favorite Touchstone Pictures Characters",1
Education FTW: ‘Sesame Street’ Showed Grover Laying An Egg That Elmo And Ernie Both Hatch Out Of To Teach Children Not Everything Can Be Explained With A Catchy Little Song,1
Use Of 'N-Word' May End Porn Star's Career,1
Man Looks On Helplessly As Variants Of His Nickname Evolve And Multiply At Breakneck Speed,1
"Nuclear, Climate Threats Keep Doomsday Clock Close To Midnight",1
USDA Just Doing Quick Smell Tests To Inspect All The Backlogged Meat That Piled Up During Shutdown,1
Mila Kunis Said What?!,1
Taliban Agrees To Peace Deal Despite Concerns About America’s Human-Rights Record,1
"‘I Want For Nothing, Mommy’: 5 Pleasureless Gifts To Give Your Ascetic 9-Year-Old For Their Birthday",1
"‘I Want For Nothing, Mommy’: 5 Pleasureless Gifts To Give Your Ascetic 9-Year-Old For Their Birthday",1
Increasingly Worried Man Hasn’t Yet Come Across Any Guacamole In Burrito,1
New Evidence In Murder Case Leads Authorities To Narrow Down List Of Possible Actors Who Could Play Killer,1
Heartwarming: These Parents Had The Most Adorable Girth Reveal Party To Announce That They’re Having A Fat Baby,1
340 Million Social Security Numbers Obtained By Federal Government In Massive Personal Data Breach,1
Howard Schultz Considering Independent Presidential Run After Finding No Initial Support Among Any Voter Groups,1
Most people don’t know this!,1
Local Brother-In-Law Heard You Can Make Shitload Of Money Doing That,1
"Record Number Now Consider Climate Change Personal Issue, Poll Finds",1
Grandma’s #MeToo Stories Fucking Horrifying,1
"The Week In Pictures – Week Of January 28, 2019",1
Sick Liberals Photoshop Brave Patriot's Face Onto a Saltine CRACKER and Lib University SHRUGS,1
Woman Knows To Stay Away From Certain Parts Of Own Psyche At Night,1
Field Market Specialists going the “extra length”- Selfie Enhancement Surgery to add extra arm for “the best angle” at an all time high.,1
Record low temperatures threaten year-round shorts guy population,1
"Reclusive Deity Hasn’t Written A New Book In 2,000 Years",1
"Intelligent, Condescending Life Discovered In Distant Galaxy",1
Report: More Unborn Babies In New York Identifying As Convicted Criminals So They Can't Legally Be Executed,1
"An Enemy In Hiding: Amongst These Innocent Male Nipples Lurks A Wicked Female Nipple! NSFW [ironically, the original submission appears to have been removed by the mods here due to not being marked as NSFW]",1
Ireland dismisses suggestion it should quit EU and join UK,1
Makers Of Good Friends Cereal Not Sure How Two Pictures Of Ann Coulter Got On Box,1
NEWS IN BRIEF Copycat Criminals Continue To Mimic Liquor Store Robbery From 1822,1
Mavericks Retire Dirk Nowitzki’s Jersey Fully Unaware He Still On Team,1
That Was Fast: Roger Stone Has Already Had A Religious Awakening And Converted To Islam In Prison,1
BuzzFeed CEO Gives Laid-Off Staffers Parting GIF,1
Government Reopens,1
Total Rebrand: Justin Bieber Has Announced That He’s Going To Be Like A 1950s Heartthrob Now By Looking Like He’s 60 And Starring In 140 Movies Where He Sings Like A Ghost,1
All Done Now: A Team Of Archaeologists Has Discovered A Pile Of Bones Labeled ‘The Last Of The Bones’,1
It’s about time!,1
Self-Care FTW! This New App Sends You Daily Reminders To Take Your Bra Off And Smoke Virginia Slims,1
Trump Admits He Assumed Roger Stone Was Already In Prison,1
"Judge Restricts Roger Stone’s Travel Between Fox News, InfoWars Studios While Released On Bond",1
Tony Romo Realizes He Should Have Used Ability To Read Defenses Back When He Was Still Playing,1
5 Things To Know About ‘Kingdom Hearts 3’,1
Jared Kushner Assures Reporters He Never Revealed State Secrets Without Turning Huge Profit,1
Report: White House Overruled Intelligence Officials For Rejecting Saudi Prince’s Top Secret Security Clearance,1
More Dysfunction: The Secret Service Just Accidentally Shot Eric Trump After Catching Him Trying On His Dad’s Swim Trunks And Mistaking Him For An Intruder,1
Marine Biologists Train Highly Intelligent Octopus To Profitably Manage Mid-Size Aluminum Goods Supplier,1
Taxation In America: Myth Vs. Fact,1
"We Sat Down With 10 Doctors And Asked, Is It Cancer? Oh God, It’s Cancer, Isn’t It?",1
Growing Number Rely On Traditional Outlets Amidst Growth In Fake News,1
Study Finds 68% Of Americans Unprepared For Sudden Financial Stability,1
FEMA Recommends Americans Always Have Go-Bag Packed In Case Past Finally Catches Up With Them,1
Fanatically Devoted Nerd Could Potentially Turn On Simon Pegg At Any Moment,1
YouTube Bans Dangerous Prank Videos,1
‘The Conners’ Scores Big Ratings By Killing Off Rest Of Family,1
An Enemy In Hiding: Amongst These Innocent Male Nipples Lurks A Wicked Female Nipple!,1
E.L. James Admits New Erotic Novel Originally ‘Tiny Toons’ Fan Fiction,1
Inclusivity Win! The Word Problem At The End Of This Math Worksheet Has A Guy Named Alejandro In It,1
Emaciated Peter Alexander Burns Podium For Warmth After Being Locked In Abandoned Press Briefing Room Since December,1
Teen Weirded Out After Running Over English Teacher Outside Of School,1
Allergy Sufferer Dies After Being Stung By Dog,1
Masked Vigilante Takes Terrorizing Black Community Into Own Hands After Local Law Enforcement Fails To Do So,1
Bryan Singer Celebrates ‘Bohemian Rhapsody’ Oscar Nominations By Popping Open Special Bottle Of Rohypnol,1
5 Things To Know About Kamala Harris,1
Roku Pulls ‘Infowars’ Channel Following Complaints,1
Share This Video With Your Significant Other To Ask For Permission To Watch A Movie That Has Nudity In It,1
Self-Defense FTW! This Woman Likes To Think That She Could Probably Hit Someone With Her Water Bottle Pretty Hard If It Came To That,1
Dad Doesn’t Trust The Fish Here,1
Study: No Two People Have Listened To Same Band Since 2003,1
Loose-Knit Community Not Particularly Shattered By Teen’s Death,1
Rejection From Hall Of Fame Sends Roger Clemens Spiraling Into Performance-Enhancing-Drug Binge,1
Rejection From Hall Of Fame Sends Roger Clemens Spiraling Into Performance-Enhancing Drug Binge,1
Overstepping Their Bounds: CNN Has Begun Sending Way-Too-Casual Push Notifications Announcing They’re Tired And Can’t Wait For The Weekend,1
Beautiful: This Organization Takes Stray Dogs Off The Street And Puts Them Really High Up In A Tree,1
"Tweet For Everything: In 2009, Donald Trump Tweeted That Robert Mueller Is An Honest Prosecutor Who Will Lock Him Up In Prison One Day",1
Most Anticipated TV Shows Of 2019,1
"‘The Favourite,’ ‘Roma’ Top Oscars Nominations With 10 Each",1
Study: 30% Of People Who Quit Smoking Relapse After Shakily Raising Cigarette Up To Lips When Agreeing To Turn State’s Evidence,1
Doctors Assure Recovering Patient He Has Many More Years Of Looking At Phone Ahead Of Him,1
Why isn't this a thing?,1
Bryan Singer Celebrates ‘Bohemian Rhapsody’ Oscar Nominations By Popping Open Special Bottle Of Rohypnol,1
It's only right!,1
Good to know!,1
Bryan Singer Celebrates ‘Bohemian Rhapsody’ Oscar Nominations By Popping Open Special Bottle Of Rohypnol,1
Wealthy Teen Nearly Experiences Consequence,1
Nature Preserve Sets Up Unrealistic Expectations With Visitor’s Center Full Of Taxidermied Animals,1
Self-Conscious Puppet Has No Idea What To Do With Hands,1
The Hidden Price Of Environmentalism: The Cup You’ve Been Reusing For Water At Home All Week Has Started To Develop A Taste,1
Weak-Willed Intellectual Infant Checks To See How Many More Pages Left In Book Chapter,1
Super Bowl Set For Rams-Patriots,1
Nipple Of Baby’s Bottle Pierced For Authenticity,1
Casino Reporting Steady Profits From Slot Machine That Promises Players They Will Lose,1
New Biodiversity Program Busses In Species From Outside Ecosystems,1
Trump Covered In Own Shit After Furloughed White House Staff Fail To Bathe President,1
Giuliani: ‘Let’s Just Start Everything Over’,1
Giuliani Clarifies He Doesn’t Want Gravestone To Say ‘He Married His Cousin’ Either,1
"This Will Change the Way You Watch ‘O Brother, Where Art Thou?’",1
Kamala Harris Enters 2020 Race,1
Viral Video Sparks National Debate Around Drumming In Public,1
"Weird Kid Opts To Sit Perfectly Still, Let Universe Decide His Fate After Teacher Instructs Class To Pair Up",1
Kuwait Deploys Troop,1
Kamala Harris Assembles Campaign Staff Of Unpaid California Prison Laborers,1
Chuck Grassley Reveals He Voted Against MLK Day Due To Foreseeing How Everyone Would Dishonor His Memory,1
Incredibly Relatable: Alexandria Ocasio-Cortez Is Proving She’s Just Like Us By Wasting Her Life On Social Media,1
Public Health Alert: The CDC Has Issued A Nationwide Recall On All Salmonella,1
Man Regrets Wasting Money On College After Failing To Secure Perfect Dream Life By 24,1
Improving User Experience: Facebook Has Introduced A New Service That Will Block Facebook For $20 A Month,1
Detective Not Sure He Was Close Enough To Partner To Endlessly Pursue Killer,1
Report: Tiger That Mauled Roy Horn Still Struggling To Find Work,1
Ulta Releases Line Of Shitty Hair Ties To Give Cheap-Ass Friend Who’s Always Borrowing Them,1
Snowstorm In Chicago Delays Hundreds Of Morning Murders.,1
"Yeah, Makes Sense: Wendy’s Announced That You Should Understand The Gist Of Wendy’s By Now And They’re Not Going To Advertise Anymore",1
Public Health Alert: The CDC Has Issued A Nationwide Recall On All Salmonella,1
Schick responds to Gillette’s metoo ad by releasing misogynistic razor.,1
Mattress King Selects Wife From Small Wisconsin Village,1
Planned Parenthood Opens $8 Billion Abortionplex,1
5 Things To Know About Julián Castro,1
Trump Approval Plunges Amidst Shutdown,1
Dan Savage Disgusted By Letter From Perverted Reader Contemplating Oral Sex,1
"The Week In Pictures – Week Of January 21, 2019",1
Man Beginning To Worry That Best Meals Already Behind Him,1
Queen Elizabeth Watches As Oxen Pull Apart Farmer Who Failed To Provide Yearly Tithe Of Grain,1
Nation Celebrates MLK Day,1
Doctor Weirded Out By Patient She Just Met Providing Every Lurid Detail Of Medical History,1
Orlando Locals Fear Town Starting To Become Overrun By Tourists,1
Group Of Hunky Cardinals Appeal To Pope To Relax Celibacy Requirement,1
Peace Activist Has To Admit Barrett .50 Caliber Sniper Rifle Is Pretty Cool,1
Four Homeless People Dead In What Girlfriend Refers To As “Cuddle Weather”,1
Four Homeless Dead in What Girlfriend Refers To As “Cuddle Weather”,1
Poll Shows Increasing Number Of Voters Blame Founding Fathers For Starting America,1
Polar Vortex Splits Into U.S.-Chilling Rings,1
"New Study Finds Staring Out From Balcony With Best Friends Strongest Indicator That This Your City, Your Time",1
Michael Cohen Says He Paid To Rig Polls In Trump’s Favor,1
Chance the Rapper said WHAT?!,1
Trump Dismisses Trump As A Distraction,1
Defiant Pelosi Begins Swimming To Afghanistan After Trump Denies Use Of Government Plane,1
5 Things To Know About ‘Glass’,1
Trump Postpones Grand Opening Of Trump Tower Moscow Until Fuss Over Bombshell Report Dies Down,1
Disgraceful Mommy Shaming: Haters Are Criticizing Kourtney Kardashian Just For Swinging Her Son Around By His Feet To Catch Butterflies In His Open Mouth,1
The Saga Continues: J.K. Rowling Has Revealed That Every Now And Then The Sorting Hat Would Arbitrarily Sort A Kid Onto The New York Mets,1
‘If This Report Is True’ To Be Repeated 5.7 Billion Times Today,1
Patriots Score 2 Touchdowns Against Chiefs In Preemptive Strike Before AFC Championship Game,1
5 Things To Know About Kirsten Gillibrand,1
ICE Launches Campaign To Reunite Immigrant Children With Arresting Officer,1
"ISS Astronaut Sick Of Sharing Confined Space With Crass, Disgusting Partner From Polaris 8",1
8 Balloons For 8 Celebrities,1
I Don’t Let My Kids Watch Winnie The Pooh Because I Don’t Want Them Idolizing A Fat Virgin,1
Fans Shocked After Marie Kondo Reveals She Has Been Dating Untidy Cupboard For Past 6 Months,1
Should The Oakland A’s Have Sent Brad Pitt To Persuade Kyler Murray?,1
Yahoo! Turns 25,1
Woman Didn’t Know Progress On Toxic Masculinity Would Turn Boyfriend Into Such A Weepy Little Pansy,1
Tom Brady Feeling Guilty After Gorging Self On Full Order Of Kansas-City-Style Tap Water,1
Ready For Her Close-Up: This Actress Is Ready For Her Close-Up,1
Police: Man made bomb in Des Moines sushi restaurant because threats aren't taken seriously,1
Film Character Moves Into Beautiful Brooklyn Brownstone After Getting Dream Publishing Job,1
Mayor of Jamaica Iowa arrested for growing Marijuana in her house,1
John Bolton Insists Iran Likely Harboring Dangerous Terrorist Osama Bin Laden,1
Eddie Redmayne said WHAT?!,1
Long Overdue Repairs: The Guggenheim Museum Has Finally Raised Enough Money To Make Their Building Normal,1
6 Episodes Of 'The Office' That Flash Forward To Pam And Dwight Fucking On Jim's Grave,1
"‘Don’t Make Me Regret This,’ Mueller Tells Rick Gates Before Uncuffing Him To Work On Investigation Together",1
Pelosi Asks Trump To Delay State of the Union During Shutdown,1
5 Things To Know About ‘Glass’,1
Look at this onion XDXDXD,1
Could This Be The Last Season We See Rob Gronkowski Fully Assembled In A Patriots Uniform?,1
"Crisis At 30,000 Feet: The Pilot Of This Flight Is Sobbing And Frantically Asking Passengers If Anyone Knows How To Spay A Cat",1
Karen Pence Returns To Work As Part-Time Nude Art Model,1
Poll Finds 100% Of Americans Blame Shutdown Entirely On Colorado Representative Scott Tipton,1
Ames Executives Scrambling After New Shovel Design Leaks,1
This The Fuck Harness Sex Shop Worker Has At Home,1
Presumptuous Congressional Freshman Thinks She Can Just Come In And Represent Constituents,1
Zamboni Jams Up After Running Over Large Patch Of Loose Teeth,1
Netflix Raising Prices,1
It Happened To Me: Nick Took Over My School And Wouldn’t Leave,1
Man Nervous About Telling Date He Has Her Kids,1
Researchers: Quality Of Sleep May Be Affected By Abandoning Family In 1994,1
Biological Life Regrets Waiting 2.3 Billion Years To Try Sex,1
Report: There No Way Of Knowing Whether The Vague Award Mom Won At Work A Big Deal Or What,1
U.K. Parliament Rejects Theresa May’s Brexit Deal,1
"Woman Rushes To Hide Fragile Objects, Cover Up Sharp Corners On Tables Before Boyfriend Comes Over",1
Fox News Debuts Premium Channel For 24-Hour Coverage Of Alexandria Ocasio-Cortez,1
Amy Adams said WHAT?!,1
4 Times In ‘Legally Blonde’ Where Reese Witherspoon Breaks Character To Explain That Women Aren’t Going To Get A Better Movie Than This For The Next 20 Years,1
New Hampshire Legislature Passes Bill Naming Fentanyl State Opiate,1
"Worth A Shot: Tylenol Announced They’re Going To Try Jacking Up The Price Of Tylenol To $1,000 A Pill Like Other Drugs Do And See If People Keep Buying It",1
4 Bunnies We Must Pet And 2 Bunnies We Must Eat,1
Photo Of Egg Breaks World Record For Most-Liked Instagram Post,1
Furloughed Government Employee Using Time Off To Visit Local Food Pantry She Been Hearing About,1
Pros And Cons Of Pet Insurance,1
Lincoln Memorial Empty After Former President’s Statue Furloughed,1
Area Theater Has Strict Rule Against Bringing In Outside Movies,1
"Maximum-Security Prison Houses State’s Most Hardened, Violent Guards",1
"Fed-Up EU Rejects United Kingdom, Gives British 30 Days To Vacate Europe",1
GOP Leaders Condemn Steve King For White Supremacy Comment,1
PR Nightmare: Make-A-Wish Accidentally Sent A Costumed Hero Named Terminally Ill Spider-Man To A Healthy Kid’s House And Asked The Child To Comfort Him In His Final Hours,1
Unfortunate Development: Cousin Kyle Has Learned Even More Pressure Points Since The Last Time He Visited,1
Tommy Lee Jones said WHAT?!,1
Viagra Announces Real Medicine That Gave Customers Erections Was Confidence All Along,1
NBA Ref Petrified After Seeing Depiction Of Own Death While Looking Under Replay Hood,1
Poll Shows Increasing Number Of Voters Blame Founding Fathers For Starting America,1
William Barr Assures Senate He Will Let Donald Trump Finish His Job Without Any Interference,1
Put Down The iPad And Go Shave An Ape! 6 Awesome Things ’90s Kids Grew Up Doing To Orangutans That Kids Today Are Totally Missing Out On,1
Put Down The iPad And Go Shave An Ape! 6 Awesome Things ’90s Kids Grew Up Doing To Orangutans That Kids Today Are Totally Missing Out On,1
Government Shutdowns By The Numbers,1
Chuck Schumer Honestly Pretty Amazed He Hasn’t Caved Yet,1
Heartbreaking: Emperor Of Badminton Gets Chosen Last For Badminton Team By Gym Class Team Captain,1
FBI Opened Inquiry Into Whether Trump Working For Russians,1
Man Crouched Inside Of Robotic Welding Arm Terrified Robot Will Eventually Take His Job,1
"Mom Wants To Know If You Could Use Grandma’s Antique, 12-Person Dining Room Table In Your Studio Apartment",1
"Bengal Tigers’ Habitat Down To Studio Apartment In Jaipur, India",1
New Office Manager Provides Terrifying Glimpse Into Plans For Regime By Placing New Collection Of Teas In Drawer,1
Poll: Most Americans Blame Trump For Shutdown,1
Showbiz Nepotism: 90% Of Actors Working In Hollywood Only Got Where They Are Because Their Dad Is Jeff Garlin,1
Fans Rejoice! 5 Classic Moments Only Fans Will Remember!,1
‘Game Of Thrones’ Fans Excited To Hear Series Will Finally Be Over,1
"Christmas Really Over, Man Realizes As iPhone Game Switches Out Holiday Icon",1
GOP Strips Steve King Of Post On Powerful House Segregation Committee,1
Advisors Instruct William Barr To Avoid Referring To Trump As ‘My Liege’ During Confirmation Hearing,1
Sick Fuck: This Dog Is Way Too Happy About Smelling Cancer,1
Furloughed Federal Employee Starts Online Search For New Government,1
R&B Singer Guesses She’ll Just Keep Moaning Into Mic Until Song Is Over,1
Nation’s Idiots Announce Plans To Jump Off Their Roofs Into A Pile Of Snow And Break Their Fucking Legs,1
Tinder Announces App Will No Longer Match Users Solely With Distant Relatives,1
Report: Some Small Town Enjoying Last Days Of Anonymity Before Harrowing Tragedy,1
Local man unaware of sexual orientation after watching basketball game upclose,1
Man admits to using frozen poo-filled condom to kill his wife,1
75% Of Party Trolley Defaulting On Student Loans,1
"‘Just Take It Slow, And You’ll Be Fine,’ Drunk Driver Assures Self While Speeding Away In Stolen Police Car",1
Report: Nation’s Ditches Overflowing With Children Of Worried Parents,1
Remington Debuts New Split Barrel Murder-Suicide Shotgun.,1
Nation Not Sure How Many Ex-Trump Staffers It Can Safely Reabsorb,1
Government Shutdown Forces National Zoo To Turn Off Panda Suicide Cam,1
Greatest Country In World Unable To Keep William H. Gross Stamp Gallery Open,1
Smooth Recovery: ExxonMobil Has Played Off Their Latest Massive Oil Spill As If They Did It On Purpose,1
Ethan Hawke’s Body Found Dumped In Laurel Canyon As 2019 Oscar Race Heats Up,1
Deloitte Hires Accountant After Noticing Popular Tweets Of Audit Calculations,1
Woman’s Primal Instincts Activate To Protect Nearly Finished Glass Of Wine From Approaching Server,1
"Hundreds Of Blind, Pallid Disney Characters Discovered Living In Caves Deep Within Space Mountain",1
TSA Guy Circling Stuff On Boarding Pass With Reckless Abandon,1
Share This On Portugal’s Facebook Page To Let Them Know They Had A Good Run But It’s Time To Call It Quits,1
"This Amazing New Anti-Bullying Campaign Reminds Kids That Even Though Bullying Might Be Fun, Rewarding, And Cool, It Can Sometimes Make You Tired",1
TSA Guy Circling Stuff On Boarding Pass With Reckless Abandon,1
Alcoholic’s Plan For Turning Life Around Doesn’t Involve Getting Sober,1
Nation Excited To See Whatever Bile The Internet Spews Up Today,1
Glitch In Country Allows Citizens To Temporarily Walk Through Tables,1
Study Finds Suspicious Circumstances Still Leading Cause Of Death In Russia,1
Trump Outrages Left and Right With Tweets About Crazy Frog's Penis,1
How The Mighty Have Fallen: Jeff Bezos Has Blown His Entire Fortune Trying To Win A Giant Stuffed Taz At Six Flags,1
CIA Issues Posthumous Apology After New Evidence Clears Osama Bin Laden Of Involvement In 9/11 Attacks,1
Intrepid Middle-Class Parents Embark On Daring Search For Mythical Perfect School District,1
Area Man’s Intelligence Probably Just Too Intimidating For Most Women,1
Francis Ford Coppola Reveals Every ‘Godfather’ Film Took Place In Same Narrative World,1
"Each Year, More Than 60,000 Men Are Poached For Their Precious Corduroy. And The Crisis Is Only Getting Worse",1
Too Little Too Late: Halle Berry Has Put On A Propeller Hat To Prepare For Her 2004 Role In ‘Catwoman’,1
Tumbleweed Of Pubes Rolls Through Desolate Dorm Bathroom,1
Nation Refuses To Read Headline Beyond Words '4-Year-Old Girl Forced To',1
Serial Killer Admits He’s Lost Track Of Pattern He Was Going For Originally,1
National Endowment For The Arts Provides $80 Million To Discourage Talentless Hacks,1
